,id,keyword,location,text,target
0,1,,,our deed reason earthquak may allah forgiv us,1
1,4,,,forest fire near la rong sask canada,1
2,5,,,all resid ask shelter place notifi offic no evacu shelter place order expect,1
3,6,,,"13,000 peopl receiv wildfir evacu order california",1
4,7,,,just got sent photo rubi alaska smoke wildfir pour school,1
5,8,,,rockyfir updat california hwi 20 close direct due lake counti fire cafir wildfir,1
6,10,,,flood disast heavi rain caus flash flood street manitou colorado spring area,1
7,13,,,i 'm top hill i see fire wood ...,1
8,14,,,there 's emerg evacu happen build across street,1
9,15,,,i 'm afraid tornado come area ...,1
10,16,,,three peopl die heat wave far,1
11,17,,,haha south tampa get flood hah- wait a second i live in south tampa what am i gon na do what am i gon na do fvck flood,1
12,18,,,rain flood florida tampabay tampa 18 19 day i ve lost count,1
13,19,,,flood bago myanmar we arriv bago,1
14,20,,,damag school bus 80 multi car crash break,1
15,23,,,what 's man,0
16,24,,,i love fruit,0
17,25,,,summer love,0
18,26,,,my car fast,0
19,28,,,what goooooooaaaaaal,0
20,31,,,ridicul ....,0
21,32,,,london cool,0
22,33,,,love ski,0
23,34,,,what wonder day,0
24,36,,,looooool,0
25,37,,,no way ... i ca n't eat shit,0
26,38,,,was nyc last week,0
27,39,,,love girlfriend,0
28,40,,,cooool,0
29,41,,,do like pasta,0
30,44,,,the end,0
31,48,ablaze,Birmingham,bbcmtd wholesal market ablaz http //t.co/lhyxeohy6c,1
32,49,ablaze,Est. September 2012 - Bristol,we alway tri bring heavi metal rt http //t.co/yao1e0xngw,0
33,50,ablaze,AFRICA,africanbaz break news nigeria flag set ablaz aba http //t.co/2nndbgwyei,1
34,52,ablaze,"Philadelphia, PA",cri set ablaz,0
35,53,ablaze,"London, UK",on plus side look at the sky last night it was ablaz http //t.co/qqsmshaj3n,0
36,54,ablaze,Pretoria,phdsquar mufc ve built much hype around new acquisit i doubt set epl ablaz season,0
37,55,ablaze,World Wide!!,inec offic abia set ablaz http //t.co/3imaomknna,1
38,56,ablaze,,barbado bridgetown jamaica ûò two car set ablaz santa cruz ûó head st elizabeth polic superintend ... http //t.co/wdueaj8q4j,1
39,57,ablaze,Paranaque City,ablaz lord d,0
40,59,ablaze,Live On Webcam,check http //t.co/roi2nsmejj http //t.co/3tj8zjin21 http //t.co/yduixefip http //t.co/lxtjc87kl nsfw,0
41,61,ablaze,,outsid re ablaz aliv re dead insid,0
42,62,ablaze,milky way,had awesom time visit cfc head offic ancop site ablaz thank tita vida take care us,0
43,63,ablaze,,soooo pump for ablaz southridgelif,0
44,64,ablaze,,i want set chicago ablaz preach ... but hotel http //t.co/o9qknbfofx,0
45,65,ablaze,,i gain 3 follow last week you know stat grow http //t.co/tiyulif5c6,0
46,66,ablaze,"GREENSBORO,NORTH CAROLINA",how west burn thousand wildfir ablaz california alon http //t.co/vl5tbr3wbr,1
47,67,ablaze,,build perfect tracklist life leav street ablaz,0
48,68,ablaze,Live On Webcam,check http //t.co/roi2nsmejj http //t.co/3tj8zjin21 http //t.co/yduixefip http //t.co/lxtjc87kl nsfw,0
49,71,ablaze,England.,first night retain it 's quit weird better get use i wear everi singl night next year least,0
50,73,ablaze,"Sheffield Township, Ohio",deputi man shot brighton home set ablaz http //t.co/gwnrhmso8k,1
51,74,ablaze,India,man wife get six year jail set ablaz niec http //t.co/ev1ahoucza,1
52,76,ablaze,Barbados,santa cruz ûó head st elizabeth polic superintend lanford salmon r ... http //t.co/vplr5hka2u http //t.co/sxhw2tnnlf,0
53,77,ablaze,Anaheim,polic arsonist deliber set black church in north carolinaåêablaz http //t.co/pcxarbh9an,1
54,78,ablaze,Abuja,noch el-bestia alexis_sanchez happi see teammat train hard goodnight gunners. http //t.co/uc4j4jhvgr,0
55,79,ablaze,USA,kurd trampl turkmen flag later set ablaz other vandal offic turkmen front diyala http //t.co/4izfdyc3cg,1
56,80,ablaze,South Africa,truck ablaz r21 voortrekk ave. outsid or tambo intl cargo section http //t.co/8kscqkfkkf,1
57,81,ablaze,"Sao Paulo, Brazil",set heart ablaz everi citi gift and everi skylin like kiss upon lip û_ https //t.co/cyompz1a0z,0
58,82,ablaze,hollywoodland ,they sky ablaz tonight los angel i 'm expect ig fb fill sunset shot i know peep,0
59,83,ablaze,"Edmonton, Alberta - Treaty 6",how west burn thousand wildfir ablaz california alon http //t.co/icsjgz9te1 climat energi http //t.co/9fxmn0l0bd,1
60,85,ablaze,,revel wmv video mean mac farewel ablaz wmv en rout dvd gtxrwm,0
61,86,ablaze,Inang Pamantasan,progress greet in month student would set pen ablaz the torch public ... http //t.co/9fxpixqujt,0
62,89,ablaze,Twitter Lockout in progress,rene ablaz amp jacinta secret 2k13 fallen sky edit mar 30 2013 https //t.co/7mlmsuzv1z,0
63,91,ablaze,"Concord, CA",navista7 steve fire someth els california tinderbox clown set hood ablaz news24680,1
64,92,ablaze,"Calgary, AB",nowplay rene ablaz amp ian buff magnitud http //t.co/av2jsjfftc edm,0
65,93,ablaze,Birmingham,nxwestmidland huge fire wholesal market ablaz http //t.co/rwzbfvnxer,1
66,95,ablaze,San Francisco,ablaz time talk go i n't know i make due work,0
67,96,accident,CLVLND,i ca n't kid cuz i got bicycl accid amp split testicl 's imposs kid michael you are the father,0
68,97,accident,"Nashville, TN",accid i-24 w nashvilletraff traffic move 8m slower usual https //t.co/0ghk693egj,1
69,98,accident,"Santa Clara, CA",accid center lane block santaclara us-101 nb great america pkwi bayarea traffic http //t.co/pmlohzurwr,1
70,100,accident,UK,http //t.co/gkye6gjtk5 had personalinjuri accid summer read advic amp see solicitor help otleyhour,0
71,102,accident,"St. Louis, MO",stloui caraccidentlawy speed among top caus teen accid https //t.co/k4zomof319 https //t.co/s2kxvm0cba car accid teeû_,0
72,104,accident,"Walker County, Alabama",report motor vehicl accid curri herman rd near stephenson involv overturn vehicl pleas use ... http //t.co/ybjezkurw1,1
73,105,accident,Australia,bigrigradio live accid awar,1
74,107,accident,North Carolina,i-77 mile marker 31 south mooresvill iredel vehicl accid ramp close 8/6 1:18 pm,1
75,109,accident,,rt sleepjunki sleep pill doubl risk car accid http //t.co/7s9nm1fict,0
76,110,accident,Norf Carolina,by accid knew gon happen https //t.co/ysxun5vceh,0
77,112,accident,"San Mateo County, CA",traffic accid n cabrillo hwy/magellan av mir 08/06/15 11:03:58,1
78,113,accident,North Carolina,i-77 mile marker 31 40 south mooresvill iredel vehicl accid congest 8/6 1:18 pm,1
79,114,accident,"Njoro, Kenya",pastor scene accid ...... owner rang rover,1
80,117,accident,,mom we n't get home fast wish whi mom there accid truck spilt mayonnais,0
81,118,accident,Your Sister's Bedroom,i horribl car accid past sunday i 'm final abl get around thank god,1
82,119,accident,,can wait see piss donni i tell i anoth accid,0
83,120,accident,"Arlington, TX",truckcrash overturn on fortworth interst http //t.co/rs22lj4qfp click ve crash gt http //t.co/ld0uniyw4k,1
84,121,accident,"South Bloomfield, OH",accid ashvill us 23 sb sr 752 traffic http //t.co/hylmo0wgfi,1
85,126,accident,,carolina accid motorcyclist die i-540 crash with car that cross median a motorcycl rider travel ... http //t.co/p18lzrlmy6,1
86,128,accident,"New Hanover County, NC",fyi cad fyi accid properti damag nhs 999 piner rd/horndal dr,1
87,129,accident,Maldives,rt naayf first accid year turn onto chandane magu near mma taxi ram i halfway turn everyon confû_,1
88,130,accident,"Manchester, NH",accid left lane block manchest rt 293 nb eddi rd stop go traffic back nh-3a delay 4 min traffic,1
89,131,accident,"Wilmington, NC",accid properti damag piner rd/horndal dr,1
90,132,accident,,accid http //t.co/oia5fxi4gm,0
91,133,accident,"New Hanover County, NC",fyi cad fyi accid properti damag wpd 1600 s 17th st,1
92,134,accident,,8/6/2015 2:09 pm traffic accid no injuri 2781 willi foreman rd http //t.co/vckit6edev,1
93,135,accident,global,aashiqui actress anu aggarw on her near-fat accid http //t.co/6otfp31lqw,1
94,136,accident,Alberta | Sask. | Montana,suffield alberta accid https //t.co/bptmlf4p10,1
95,137,accident,Charlotte,9 mile backup i-77 south ... accid block right 2 lane exit 31 langtre rd ... consid nc 115 nc 150 nc 16 altern,1
96,138,accident,"Baton Rouge, LA",has accid chang life we help determin option financi support life care plan on-go treatment,0
97,139,accident,"Hagerstown, MD",break dead motorcycl car accid happen hagerstown today i ll detail 5 your4stat whag,1
98,141,accident,"Gloucestershire , UK",flowri marinad accid,0
99,143,accident,,car even week got fuck car accid .. mfs ca n't fuck drive,1
100,144,accident,UK,norwaymfa bahrain polic previous die road accid kill explos https //t.co/gfjfgtodad,1
101,145,accident,"Nairobi, Kenya",i still heard church leader kenya come forward comment accid issu disciplinari measur arrestpastornganga,0
102,146,aftershock,Instagram - @heyimginog ,aftershock_delo scuf ps live game ... cya,0
103,149,aftershock,304,the man drive effort get pain man win roger bannist,0
104,151,aftershock,Switzerland,320 ir icemoon aftershock http //t.co/ynxnvvkcda djicemoon dubstep trapmus dnb edm danc icesû_ http //t.co/weqpesenku,0
105,153,aftershock,304,there victori bargain basement price dwight david eisenhow,0
106,156,aftershock,US,320 ir icemoon aftershock http //t.co/vam5podgyw djicemoon dubstep trapmus dnb edm danc icesû_ http //t.co/zevakjapcz,0
107,157,aftershock,304,nobodi rememb came second charl schulz,0
108,158,aftershock,Instagram - @heyimginog ,aftershock_delo im speak someon use scuf xb1 peopl end get ps also,0
109,159,aftershock,304,the harder conflict glorious triumph thoma pain,0
110,160,aftershock,,growingupspoil go clay pigeon shoot cri aftershock,0
111,161,aftershock,Somewhere Only We Know ?,so guess one actual want free aftershock tc .....,0
112,162,aftershock,,aftershock terrifi best roller coaster i ve ever disclaim i ve,0
113,163,aftershock,Belgium,aftershock https //t.co/xmwodfmtui,0
114,164,aftershock,Switzerland,320 ir icemoon aftershock http //t.co/m4jdzmgjow djicemoon dubstep trapmus dnb edm danc icesû_ http //t.co/n0uhasfkbv,0
115,165,aftershock,US,320 ir icemoon aftershock http //t.co/vam5podgyw djicemoon dubstep trapmus dnb edm danc icesû_ http //t.co/zevakjapcz,0
116,168,aftershock,,320 ir icemoon aftershock http //t.co/e14epzhoth djicemoon dubstep trapmus dnb edm danc icesû_ http //t.co/22a9d5do6q,0
117,170,aftershock,dope show,kjforday i 'm see issu aftershock,0
118,171,aftershock,Switzerland,320 ir icemoon aftershock http //t.co/thyzomvwu0 djicemoon dubstep trapmus dnb edm danc icesû_ http //t.co/83joo0xk29,0
119,172,aftershock,Switzerland,320 ir icemoon aftershock http //t.co/thyzomvwu0 djicemoon dubstep trapmus dnb edm danc icesû_ http //t.co/83joo0xk29,0
120,173,aftershock,"Oshawa, Canada",wisdomw bonus 5 minut daili habit could realli improv life how mani alreadi lifehack http //t.co/tbm9fqb8cw,0
121,174,aftershock,Baker City Oregon,aftershock protect yourself profit next global financi meltdown david wiedem http http //t.co/wztz4hgmvq,0
122,175,aftershock,,that moment get scari roller coaster guy behind scream bloodi murder silverwood aftershock,0
123,176,aftershock,,aftershock ã¢ 2010 fullã¢ stream youtub http //t.co/vve3usesgf,0
124,178,aftershock,United States,gt gt 15 aftershock protect yourself profit next global financi ... book http //t.co/f6ntuc734z esquireattir,0
125,180,aftershock,304,sometim face difficulti re someth wrong re someth right joel osteen,0
126,182,aftershock,304,the thing stand dream tri belief actual possibl joel brown,0
127,183,aftershock,marysville ca ,prais god ministri tell like wdyouth biblestudi https //t.co/ujk0e5gbcc,0
128,184,aftershock,304,rememb go die best way i know avoid trap think someth lose ûò steve job,0
129,185,aftershock,"Hermosa Beach, CA",tri orang aftershock today my life never,0
130,187,aftershock,,onfireand i love bb,0
131,190,aftershock,,aftershock https //t.co/jv8ppkhjy7,0
132,191,aftershock,,aftershock back school kick great i want thank everyon make possibl what great night,0
133,193,aftershock,304,peopl say done interrupt ûò georg bernard shaw,0
134,194,aftershock,304,the first man get oyster second man get shell andrew carnegi,0
135,195,aftershock,,anyon need p/u tonight i play hybrid slayer ps4 eu hmu cod8sandscrim empirikgam codawscrim 4tp_kotc 4tpfa aftershock_org,0
136,196,airplane%20accident,"19.600858, -99.047821",expert franc begin examin airplan debri found reunion island french air accid expert ... http //t.co/yvvpznzmxg news,1
137,197,airplane%20accident,Pennsylvania,strict liabil context airplan accid pilot error common compon aviat cr ... http //t.co/6cz3bohrd4,1
138,198,airplane%20accident,"Salt Lake City, Utah",crobscarla lifetim odd die airplan accid 1 8015,0
139,199,airplane%20accident,"Palo Alto, CA",expert franc begin examin airplan debri found reunion island french air accid expert wedn ... http //t.co/bkpfpogysi,1
140,201,airplane%20accident,,alexalltimelow awwww re airplan accid re gon na die cuti good job,1
141,203,airplane%20accident,"Spain but Opa-Locka, FL",famili member osama bin laden die airplan accid iron mhmmm gov shit suspect,1
142,204,airplane%20accident,"Jaipur, India",man goe airplan engin accid http //t.co/tyjxrfd3st via youtub,1
143,205,airplane%20accident,Hyderabad Telangana INDIA,horribl accid man die in wing airplan 29-07-2015 http //t.co/i7kztevb2v,1
144,208,airplane%20accident,"Eagle Pass, Texas",a cessna airplan accid ocampo coahuila mexico juli 29 2015 kill four men includ state coahuila govern offici,1
145,209,airplane%20accident,bangalore,horribl accid man die in wing airplan 29-07-2015 watchthevideo http //t.co/p64xrvgjik,1
146,210,airplane%20accident,Financial News and Views,expert franc begin examin airplan debri found reunion island http //t.co/lsmx2vwr3j french air accid expert wednesdayû_,1
147,211,airplane%20accident,,expert franc begin examin airplan debri found reunion island french air accid expert wednesday began examin ...,1
148,212,airplane%20accident,Indonesia,kca votejkt48id mbataweel rip binladen famili member kill airplan 's accid,1
149,213,airplane%20accident,y(our) boyfriends legs ,i almost sent cowork nude accid thank god airplan mode,0
150,215,airplane%20accident,"New Mexico, USA",mickinyman theatlant that might kill airplan accid night car wreck polit 's best,0
151,216,airplane%20accident,Somewhere Out There,expert franc begin examin airplan debri found reunion island french air accid expert ... http //t.co/tagzbcxfj0 mlb,1
152,218,airplane%20accident,,this unbeliev insan man airport airplan aircraft aeroplan runway accid freakyû_ https //t.co/cezhq7czl,1
153,219,airplane%20accident,Mumbai india,horribl accid man die in wing airplaneåê 29-07-2015 http //t.co/wq3wjsgphl,1
154,220,airplane%20accident,sri lanka,horribl accid man die in wing airplan 29-07-2015 http //t.co/tfcdronra6,1
155,221,airplane%20accident,Not a U.S resident,usama bin ladin famili dead airplan crash natur accid,1
156,222,airplane%20accident,,pilot die in plane crash at car festiv https //t.co/kq9ae6ap2b via youtub crash aircraft airplan pilot death accid carfest,1
157,225,airplane%20accident,"Lehigh Valley, PA",strict liabil context airplan accid http //t.co/gibyqhhkpk,1
158,226,airplane%20accident,Canada,dtn brazil expert franc begin examin airplan debri found reunion island french air accid exp ... http //t.co/m9ig3wq8lq,1
159,229,airplane%20accident,,expert franc begin examin airplan debri found reunion island french air accid expert wedn ... http //t.co/v4smaeslk5,1
160,231,airplane%20accident,Thrissur,horribl accid man die in wing of ûïairplaneû 29-07-2015 wtf you canûªt believ your eye ûò ... http //t.co/6ffylajwp,1
161,232,airplane%20accident,Havenford,nicol fletcher one victim crash airplan time ago the accid left littl bit trauma although 's,1
162,235,airplane%20accident,India,omg horribl accid man die wing airplan http //t.co/xdxdprcpn,1
163,237,airplane%20accident,92,omg i n't believ rip bro airplan accid jetengin turbojet bo g90 http //t.co/kxxnszp6nk,1
164,238,airplane%20accident,,expert franc begin examin airplan debri found reunion island french air accid expert wednesday began examin ...,1
165,240,airplane%20accident,Israel,i airplan accid,1
166,241,airplane%20accident,Fashion Heaven. IG: TMId_,my phone look like car ship airplan accid terribl,0
167,242,airplane%20accident,"San Francisco, CA",statist i 'm risk get kill cop i die airplan accid,0
168,243,airplane%20accident,italy,airplan crash hous colombia 12 peopl die accid https //t.co/zhjlflbhzl,1
169,244,airplane%20accident,nyc,the shoot airplan accid https //t.co/iecc1jdoub,1
170,245,airplane%20accident,Toronto,could drone caus airplan accid pilot worri use drone esp close vicin airport http //t.co/kz35rgngjf,1
171,246,ambulance,,earli wake call sister beg come amp ride w/her ambul hospit rodkiai,1
172,247,ambulance,Jackson,http //t.co/ay6zzcupnz twelv fear kill pakistani air ambul helicopt crash http //t.co/sc9dns41mc,1
173,248,ambulance,New York / Worldwide,two air ambul scene serious crash two car lorri ... http //t.co/9pfeaqeski http //t.co/fntg70rnkx emsneû_,1
174,249,ambulance,,twelv fear kill pakistani air ambul helicopt crash reuter http //t.co/mdnugvubwn yugvani,1
175,251,ambulance,"New Orleans, LA",lead emerg servic boss welcom new ambul chariti http //t.co/mj2jq2psv6,0
176,252,ambulance,West Wales,anyon travel aberystwyth-shrewsburi right 's incid servic halt outsid shrew ambul scene,1
177,253,ambulance,,twelv fear kill pakistani air ambul helicopt crash http //t.co/xum8ylcb4q,1
178,254,ambulance,Happily Married with 2 kids ,ambul sprinter automat frontlin vehicl choic of 14 lez compliant ebay http //t.co/4evttqpeia,0
179,256,ambulance,"Cambridge, MA",new nanotech devic will be abl to target and destroy blood clot http //t.co/hfy5v3slbb,0
180,258,ambulance,Arizona ,20skyhawkmm20 traplord_29 fredosantana300 lilreese300 hella crazi 3 fight ambul coupl mosh pit,1
181,260,ambulance,Mumbai,if i get run ambul i lucki justsay randomthought,0
182,261,ambulance,,news twelv fear kill pakistani air ambul helicopt crash http //t.co/bfes5twbzt til_now dna,1
183,262,ambulance,Amsterdam,http //t.co/7xglah10zl twelv fear kill pakistani air ambul helicopt crash http //t.co/thmblaatzp,1
184,263,ambulance,"Swindon,England ",tanslash wait ambul,0
185,264,ambulance,,fouseytub ok need ambul hahahah good http //t.co/zsberqnn9n,0
186,265,ambulance,Happily Married with 2 kids ,ambul sprinter automat frontlin vehicl choic of 14 lez compliant ebay http //t.co/q8ivrzojzv,0
187,266,ambulance,,pakistan air ambul helicopt crash kill nine http //t.co/8e7ry8ebmf,1
188,267,ambulance,"Williamstown, VT",thenissonian rejectdcartoon nissan ok need medic assist call ambul need,0
189,268,ambulance,"North Carolina, USA",ems1 ny emt petit 17 per hour û÷minimum wageûª http //t.co/4oa6swlxmr em paramed ambul,0
190,269,ambulance,,http //t.co/fcqmkffflw twelv fear kill pakistani air ambul helicopt crash http //t.co/vayaymbngu,1
191,270,ambulance,Karachi,twelv fear kill pakistani air ambul helicopt crash http //t.co/3brme6sn4t,1
192,271,ambulance,Happily Married with 2 kids ,ambul sprinter automat frontlin vehicl choic of 14 lez compliant ebay http //t.co/ujrx9kgawp,0
193,272,ambulance,Happily Married with 2 kids ,ambul sprinter automat frontlin vehicl choic of 14 lez compliant ebay http //t.co/kp2lf4aut,0
194,273,ambulance,Loveland Colorado,kiwi_karyn check 's park lot he said last year ambul st john http //t.co/hpvodud7ip,0
195,274,ambulance,|| c h i c a g o ||,n't know way ambul come lt lt,1
196,276,ambulance,,reuter twelv fear kill pakistani air ambul helicopt crash http //t.co/shzpyiqok5,1
197,277,ambulance,L. A.,http //t.co/pwwpum6rbj twelv fear kill pakistani air ambul helicopt crash http //t.co/yspon4d6qo,1
198,279,ambulance,,whi ambul right outsid work,0
199,280,ambulance,Canada,ûï leoblakecart this dog think 's ambul http //t.co/mg1lpgr0rmû natasha_rideout,0
200,281,ambulance,VISIT MY YOUTUBE CHANNEL.,happen now hatzolah em ambul respond with dual siren andû_ https //t.co/sek6mq6njf,0
201,283,ambulance,Lexington,http //t.co/fuerk0gwui twelv fear kill pakistani air ambul helicopt crash http //t.co/mv7ggglmvc,1
202,285,ambulance,,http //t.co/x5yeuylt1x twelv fear kill pakistani air ambul helicopt crash http //t.co/2ugrmd1z1n,1
203,287,ambulance,USA,twelv fear kill pakistani air ambul helicopt crash http //t.co/th9ywbbeet worldnew,1
204,289,ambulance,"Hannover, Germany",twelv fear kill pakistani air ambul helicopt crash http //t.co/x2qsjod40u worldnew,1
205,290,ambulance,,what 's polic ambul number lesotho ani bodi know,0
206,291,ambulance,,medic914 aace_org i surpris still standardis clinic practic across 11 nhs ambul trust,0
207,293,ambulance,Playa,http //t.co/j8tyt1xrrk twelv fear kill pakistani air ambul helicopt crash http //t.co/9d4nazoi94,1
208,294,ambulance,"Davidson, NC",peopl tri j-walk ambul pass ... i hate,0
209,296,annihilated,Higher Places,the episod trunk annihil freiza cleanest shit ever he show nigga merci,0
210,297,annihilated,"Horsemind, MI",they shall be annihil and all of their petebest dessic and laid bare then you shall kneel befor me,0
211,298,annihilated,"New York, NY",urib annihil basebal met,0
212,299,annihilated,Boksburg,marksmaponyan hey sundown annihil previous meet celtic.inde improv,0
213,301,annihilated,,volfan326 tneazzi mizzou annihil florida past 2 season even end muschamp 's career ca n't compet bama,0
214,302,annihilated,,annihil ab http //t.co/1xpw292tj,1
215,303,annihilated,,be annihil status educ mba behalf easi street careen eovm http //t.co/e0pi0c54ff,0
216,307,annihilated,"V-RP @OZRP_ ?MV, AU, R18+?",luka they die all everyth annihil aloi tranci,0
217,309,annihilated,"Greater Manchester, UK",acarewornheart have good un fella sorri i wo n't get annihil,0
218,310,annihilated,Boston,cop pull drunk driver safeti second car hit train http //t.co/thrhkhogcuåê http //t.co/tzszmf2qx via viralspel,1
219,312,annihilated,,you must annihil,0
220,313,annihilated,,cop pull drunk driver safeti second car hit train http //t.co/c0nkgp6w03åê http //t.co/imwmfdjssn via viralspel,1
221,314,annihilated,The Canopy Kingdom,boom your countri entir annihil hû_ ûó britain https //t.co/irfcn71szv,0
222,315,annihilated,,amirkingkhan would annihil might well thank floydmayweath,0
223,316,annihilated,USA,one thing sure-god promis israel annihil but ... horror iran w/nuke https //t.co/xn09mx6sxi,0
224,318,annihilated,,violentfeminazi i guess 's ok armenian sinc ve spent histori get annihil,1
225,320,annihilated,,70 year sinc annihil 100000 peopl instant becam awar abil annihil whole human,1
226,321,annihilated,the own zone layer ,day 1 tryout went good minus fact i stop quick get short ball annihil toenail injuri even,0
227,322,annihilated,London,dure 1960s oryx symbol arabian peninsula annihil hunter http //t.co/yangeqbuqw http //t.co/jq2eh5kglt,1
228,327,annihilated,Trancy Manor,to luka they die all everyth annihil aloi tranci,0
229,328,annihilated,,readi get annihil buc game,1
230,329,annihilated,South 37,philipduncan breakfaston peopl annihil last night weather ... realli philip thought would forecast ...,1
231,330,annihilated,,domain sophist annihil close up-to-the-minut feat zrnf,0
232,331,annihilated,"West Lancashire, UK.",stormbeard steel_lord i seen juda priest 2005 rob came back scorpion support fuck annihil place astonish gig,0
233,332,annihilated,PA,offici skip fantasticfour/ fant4stic/whatev hashtag it 's get annihil review bummer,0
234,334,annihilated,,tomcatart thus explain annihil but case survivor evolv becam godlik,1
235,335,annihilated,Û¢ Views From The Six Û¢,complet annihil cech paul keegan time aliv,0
236,336,annihilated,,tomcatart who annihil legion the survivor imperfect hybrid project quick form new secret cell,0
237,337,annihilated,University of Toronto,sirbrandonknt exact that 's lesnar/cena match summerslam last year great brock annihil guy 's,0
238,338,annihilated,,cop pull drunk driver safeti second car hit train http //t.co/f1bakpnyn6åê http //t.co/lzxwoaye4x via viralspel,1
239,340,annihilated,Swaning Around,annihil in damascus syrian armi grind û÷alloosh and his gang into the manur pile http //t.co/7rakhp3bwm,1
240,341,annihilated,,thatd ok n't complet forthright may also food coma bc kebab/tahini/pickl also annihil w/fri,0
241,344,annihilated,London,a fun fill happy-hour simmon bar camden handsom one i got annihil apart game http //t.co/4jno677zkv,0
242,345,annihilated,Albany/NY,juanni beisbol sr. annihil ball lgm,0
243,346,annihilation,"California, USA",rvfriedmann hell fraction belief total annihil destruct usa lodisilverado ritzy_jewel,1
244,347,annihilation,,potus mayb call israel tell re sorri pres sold river annihil,0
245,348,annihilation,,evildead annihil civil http //t.co/spfke5kqu4,0
246,349,annihilation,,u. nation park servic tonto nation forest stop annihil salt river wild hors ... http //t.co/6lojoorouk via chang,0
247,352,annihilation,Wild Wild Web,annihil quarterstaff annihil,1
248,353,annihilation,Subconscious LA,world annihil vs self transform http //t.co/pyehwodwun alien attack extermin human http //t.co/pb2n77nskz,0
249,354,annihilation,Spain,starmad stardat 3 planetari annihil http //t.co/i2hhviumtm via youtub,1
250,355,annihilation,,u. nation park servic tonto nation forest stop annihil salt river wild hors ... https //t.co/m8mvdspjp7 via chang,0
251,356,annihilation,CA physically- Boston Strong?,u. nation park servic tonto nation forest stop annihil salt river wild hors ... https //t.co/sw1sbua3mn via chang,1
252,358,annihilation,"Yeezy Taught Me , NV",kimkardashian pleas sign share petit save wild hors arizona http //t.co/3tssxphuf,0
253,360,annihilation,,u. nation park servic tonto nation forest stop annihil salt river wild hors ... http //t.co/kpqk0c4g0m via chang,1
