,id,keyword,location,text,target
1919,2760,curfew,"Chicago, IL",polic teenag arrest curfew violat evanston ride stolen bicycl two teenag taken cus ... chicago news,1
1920,2761,curfew,,reason im listen curfew overtim stuck kodak,0
1921,2763,curfew,somewhere in cali ,bobbyxfish i ve gave curfew,0
1922,2765,curfew,Im Around ... Jersey,curfew realli help if think ... bc,0
1923,2766,curfew,Garden Grove,exofficio men 's boxer brief curfew larg http //t.co/acb0ryenuo,0
1924,2767,curfew,"Adelaide, Australia",info s. wnd 030/6 cld sct014 bkn032 exp inst apch rwi 05 curfew in oper until 2030 z. taxiway foxtrot 5 amp foxtrot 6 navbl tmp 10,0
1925,2768,curfew,,emaaalay thank i n't citi wide curfew,0
1926,2769,curfew,,she said curfew nope,0
1927,2770,curfew,BKI-KUA,her curfew start right privat class end tutor must woman prefer someon 50,0
1928,2771,curfew,,aptly_engineerd there curfew,0
1929,2773,curfew,urÌ£nus,it past curfew grove,0
1930,2774,curfew,"Illinois, USA",emmychappi becaus 's 12 o'clock mom said everyon go home curfew,1
1931,2777,curfew,A.A.S my Aztec Princess,reddakushgodd said month but i get curfew time smfh,0
1932,2778,curfew,turner fenton,ball curfew https //t.co/sg1ftkaegq,0
1933,2780,curfew,,scotrail seen turn blind eye bloke drink smoke curfew time cos'it worth hassl,1
1934,2782,curfew,"KLA,Uganda",next may i ll free ... school oblig like famili .... best damn curfew ...,1
1935,2783,curfew,Uganda,daviskawalya i know mauryn143 say final goodby grandpa seen news rip me alway open idea may curfew,0
1936,2784,curfew,,peopl realli still curfew even re 18 amp graduat high school,0
1937,2785,curfew,253,stupid_niggr i 'm tell mom past curfew oth,0
1938,2786,curfew,"Elkhart, IN",had cancel cat doctor appoint decid go play come home curfew ...,0
1939,2787,curfew,"Adelaide, Australia",info r. curfew in oper until 2030 z. taxiway foxtrot 5 amp foxtrot 6 navbl wnd 060/5 exp inst apch rwi 05 damp tmp 10 qnh 1028,0
1940,2788,curfew,California,but lie though it 's pay oldest sometim like first get car curfew freedom donthat,0
1941,2792,curfew,"Adelaide, Australia",info u. cld sct012 bkn025 exp inst apch rwi 05 curfew in oper until 2030 z. taxiway foxtrot 5 amp foxtrot 6 navbl tmp 10 wnd 030/6,0
1942,2793,curfew,Pon Di Gully,rite man tlk widout nuh curfew long side aka cum fi steal di show itz rubberi di whole dem fi knw ... sound music,0
1943,2794,curfew,Benedict College,dont even come worri curfew bc19,0
1944,2795,curfew,HTX,you got whole curfew,0
1945,2796,curfew,,when re 5 hour late curfew pray dog n't bark unlock door,0
1946,2797,curfew,IM LOST ,da judg gave dis girl 5pm curfew,0
1947,2799,curfew,Miami,in begin summer mom made curfew 1 's back 12 i never go wonder i 'm alway home,0
1948,2801,curfew,,whi charli lim start 9pm sunday ..... i curfew leh,0
1949,2802,curfew,"Hamilton, ON",when u bomb and u tri 2 get home for curfew http //t.co/oi6cmagasi,0
1950,2803,cyclone,United Kingdom,awwww babi walter rewatchingthepilot teamscorpion cyclon,0
1951,2807,cyclone,"Des Moines, Iowa ",the big ten annual footbal media day get 's cyclon hoop recruit nugget,1
1952,2808,cyclone,USA,camera art photographi http //t.co/tjgxdc3d5p 0215 new boltåêcyclon dr pp-400dr dual outlet power packåêfor extern camera flash 30û_,0
1953,2811,cyclone,Rural Northern Nevada,mccauleysdesign abysmaljoin dyamiplotk work purpos a larg cyclon would better i n't 4k this 500,0
1954,2813,cyclone,Republic of the Philippines,a new tropic cyclon form near guam onc form call molav,1
1955,2815,cyclone,,video new de jhaustin thoma cyclon ame tribun ame tribun video new de jhaustin thoma onû_ http //t.co/stw3pg3t0o,0
1956,2817,cyclone,,xhnew we need plant pacif cyclon season would help,1
1957,2819,cyclone,,bbc forc to retract fals claim about cyclon pam http //t.co/tbbobvcotj via wordpressdotcom,1
1958,2820,cyclone,,great condit easton cyclon softbal bat fastpitch -9 29/20 sk398 http //t.co/ra2majpkq2 http //t.co/y7ghhyk05b,1
1959,2821,cyclone,Philippines ,sever weather bulletin no 5 for typhoon ûï hannaphû soudelor tropic cyclon warn issu at 5:00 pm 06 ... http //t.co/qhwe5k7xuw,1
1960,2822,cyclone,"Washington, DC",the cyclon deriv power calm center so person norman vincent peal,1
1961,2825,cyclone,hyderabad,roughdeal1 ant hudhud cyclon chandrababu vall ne ant ga,1
1962,2826,cyclone,Vancouver (HQ) and worldwide,cyclon komen devast famili myanmar week we need help today http //t.co/fcujsioyqo,1
1963,2827,cyclone,"Quezon City, Philippines",sever weather bulletin 6 tropic cyclon warn typhoon hanna issu 11:00 p.m. thursday 06 august ... http //t.co/fqv47ob8g,1
1964,2828,cyclone,Geneva,back futur vanuatu cyclon pam encourag tradit way live http //t.co/afmkcfn1tl http //t.co/6qzxfk2lf,1
1965,2829,cyclone,"Hartford,  connecticut",bank manag ask tom interview what cyclon tom it loan given purchas bicycl,0
1966,2830,cyclone,"Sioux Falls, SD",excit cyclon footbal https //t.co/xqv6gzzmmn,0
1967,2831,cyclone,Cornwall,bbc forc to retract fals claim about cyclon pam http //t.co/cihc8nrc9h via wordpressdotcom,1
1968,2832,cyclone,Beside Basketball,talent misdirect cyclon pass ignit pass vanish drive phantom shot kurokobot,1
1969,2833,cyclone,"Rome, Italy",now comdev asia radio station bangladesh broadcast program address upcom cyclon komen http //t.co/iovr4ymlkp,1
1970,2835,cyclone,Tafekop Ga-Matsepe,like cyclon imperi spin across globe militar crush peopl suck blood like ... http //t.co/n3vbtc6nca,1
1971,2836,cyclone,,1970 mercuri cyclon gt hood mould veri nice core cobra jet 429cj gt http //t.co/jobvbvkfnz http //t.co/c8zpmzhtd,0
1972,2838,cyclone,,i 'm cyclon passion overblown https //t.co/mmzgphnknp,0
1973,2839,cyclone,,his majesti emperor salman khan 's unstopp cyclon of entertain human bajrangi bhaijaan creat histori everywher crose 300 cr,0
1974,2841,cyclone,,1970 mercuri cyclon gt quarter panel d/s rear trim mould cobra jet 429cj http //t.co/wqul8pg5px http //t.co/4ykxt3kd62,1
1975,2842,cyclone,,tropic cyclon info soudelor 945hpa maximum wind speed 45m/s maximum wind gust speed 60m/s http //t.co/nbd5ot9iew,1
1976,2843,cyclone,Melbourne,cyclone_reizei if i may ask cyclone-sama read jail fate rindou,0
1977,2844,cyclone,Vilnius,some drug alcohol jackson vroman hous http //t.co/5oqhq8quqv,0
1978,2846,cyclone,Geneva,blend old new vanuatu prepar futur emerg http //t.co/afmkcfn1tl http //t.co/8qqzyziaqf,0
1979,2849,cyclone,,wfp wfp deliv food to 165000 bangladesh flood victim after tropic cyclon komen dhaka ûòthe unit na ... http //t.co/fukbbedfgx,1
1980,2851,cyclone,,rohingya hous kyee nockthi hamlet taungbazar region buthidaung sever damag cyclon kasitaroch vivianunhcr,1
1981,2852,cyclone,Made in America,cyclon doubl g would cherri top outfit ootd doubleghat http //t.co/jsuhupz6vp http //t.co/n5vrffrbo3,0
1982,2853,damage,"PS4, now stop asking",thelegendblu cozmo23 ll probabl allow us ascend get damag max valu,0
1983,2854,damage,,drop nigga damag,0
1984,2855,damage,Cheshire. London. #allover,union say support london yet prepar damag econom å£300m last time https //t.co/lw2fglrgxb,0
1985,2856,damage,"Texas, USA",i like youtub video http //t.co/tbx8cakdrw gta 5 onlin collater damag gta v onlin pc,0
1986,2857,damage,"Bartholomew County, Indiana",fyi accid properti damag 3460 limeston ln col yellowston way fieldston dr 08/05/2015 19:36:35,1
1987,2858,damage,U.S,fit knee damag solut http //t.co/pumbrnebj,0
1988,2860,damage,My mind is my world,and i complain phoenix mode fire emblem turn ray gigant difficulti option take 0 damag,0
1989,2861,damage,,capicapricapri brento_bento wha kid damag,0
1990,2863,damage,Catskills,clear accid properti damag ny35 eb ny 100,1
1991,2864,damage,,it 's crazi phone much damag person,0
1992,2865,damage,"Columbia, SC",writebothfist it got pretti windi ... but damag,0
1993,2866,damage,,reus advanc life equip transit drum champaign damag fdbdp,0
1994,2867,damage,Right here,indigo6 but car spot damag time check time give away baggag it 's loss wy,0
1995,2869,damage,Texas,storm damag report west tennesse http //t.co/90l2lb5wmr,1
1996,2870,damage,"Lawrence, KS via Emporia, KS",hey royal love damag 2 out,1
1997,2871,damage,http://twitch.tv/jcmonkey,drothvad cm_nevalisti keep pleas arachi 2 piec now deal 4000 weapon damag 2500,1
1998,2872,damage,Indonesia,mage fairi tail .. special properti damag natsu dragneel,0
1999,2873,damage,Unknown,bradleybrad47 yeah fast extrem high damag want fast im gon na get u the-,1
2000,2875,damage,Unknown,bradleybrad47 saw fast af great damag upgrad shitton use exclus whole playthrough,0
2001,2877,damage,"Marysville, MI",let 's say tree fall fenc do know homeown insur may help http //t.co/vlaiuvtomm http //t.co/ajpnebg803,0
2002,2878,damage,"New Haven, Connecticut",joedawg42 tor tor situat wind damag enhanc word key imo,1
2003,2879,damage,,hfxstanfield beelievedc discoverycntr happen hear runway light damag contractor,1
2004,2880,damage,Austin | San Diego,swb1192 nda written damag abil offer servic futur prolli n't want work anyway,0
2005,2881,damage,??? ?? ??????? ,if trillion cross line 3rd time field-wid attack instant kill damag,1
2006,2882,damage,"Pontevedra, Galicia",np metallica damag inc,0
2007,2883,damage,Somewhere in the Canada,nine inmat charg caus damag calgari remand centr riot http //t.co/1osmiuxkhw,1
2008,2884,damage,London/New York,pt cross-sectarian protest power shia cleric say militia must withdraw ur fightin isi wont forget damag uve done ur ppl,1
2009,2885,damage,"261 5th Avenue New York, NY ",doe homeown insur cover water damag here good thing know http //t.co/0usdi5jcho http //t.co/xyg7jhrjof,1
2010,2886,damage,,beach damag shit,1
2011,2887,damage,,wonderousallur cross arm cover hand anymor damag h-hello ..,0
2012,2888,damage,,new post blog http //t.co/avu9b4k2rv thesensualey model cam damag toronto apr 2014 nsfw pussi ass boob asian nude û_,0
2013,2889,damage,Charlotte NC,report hit amp run-in roadway-properti damag 15901 statesvill rd,1
2014,2890,damage,,devil may cri 4 special edit vergil vs agnus window mission 6 dmd no damag by leedstraif https //t.co/zhrtcvu0ff,0
2015,2891,damage,"Rockville, Maryland",glaucoma occur fluid build pressur insid eye level may damag optic nerv eyefact,1
2016,2893,damage,,jsunnew storm damag report madison counti thunderstorm damag report ar ... http //t.co/s7nbowa7tp via http //t.co/3f7owdecy7,1
2017,2895,damage,,s61.231a punctur wound without foreign bodi left index finger without damag nail initi encount icd10,1
2018,2896,damage,Australia,thank richarkkirkarch ausinstarchitect word warn queenswharf brisban http //t.co/jmkywhv7mp via financialreview,0
2019,2898,damage,Your Conversation,this real shit damag bitch,0
2020,2899,damage,USAoV,lmao fuckboy chang damag control pseudojuuzo,0
2021,2900,damage,"Bhopal, Madhya Pradesh, India.",michaelwestbiz standard damag control,1
2022,2902,damage,Tennessee,gettinglost jennellensbb muncle_jim it said superfici wound pepper spray damag,1
2023,2905,danger,,blizzhero dustinbrowd dad i wo n't chase constant amp time frequent with great deal danger distract lt 3,0
2024,2907,danger,#LemonGang ,i believ shirt compani everi anim ever danger i better start see chang wildlif,0
2025,2908,danger,ayr,danger union bear http //t.co/lhdcpnzx6a,0
2026,2909,danger,,the sign-up open fall for danger releas day blast review tour sign-up ... http //t.co/hbdo22nqpz,1
2027,2910,danger,Worldwide,dyannbridg yeshayad check rockin preview claytonbry danger zone come soon https //t.co/ipgmf4ttdx artistsunit,0
2028,2911,danger,"San Jose, California",red flag warn fire danger amp dri thunderstorm bay area http //t.co/ugzu9iqprw weather cawx nwsbayarea,1
2029,2912,danger,Worldwide,carsonrex spaceangelseven check rockin preview claytonbry danger zone come soon https //t.co/p0fizxmn5r artistsunit,0
2030,2913,danger,"Loughborough, England",what like i could danger someth,1
2031,2915,danger,Killarney,when last tree is cut down last fish eaten last stream poison you will realiz that you ... http //t.co/hskl0vq2d2,0
2032,2916,danger,"Brooklyn, NY",my take away preserv park r imposit amp danger african peopl i never imagin https //t.co/gi2p9tuvbi,0
2033,2917,danger,Lahar & Gwalior,indian govt amp media take serious concern safeti they danger https //t.co/yx1ukbmtqb,1
2034,2920,danger,"St Paul, MN",train grain wheat bare gold august heat anger i 'm trespass lest seek danger,0
2035,2921,danger,Atlanta Georgia ,therealrittz fettilootch is slanglucci oppress greatest danger come soon the album https //t.co/moll5vd8yd,0
2036,2922,danger,,morehouse64 it appear govt lost ethic moral relev this mean whole usa popul danger,0
2037,2924,danger,"Lincoln, IL",do n't like head first slide especi home danger,0
2038,2925,danger,World,permit bear hunt danger outnumb actual bear the licens florida 's fir ... http //t.co/fp64yosjwx st petersburg,0
2039,2927,danger,Spinning through time.,riverroam and much danger pleas,0
2040,2929,danger,Atlanta Georgia ,bluebirddenv fettilootch is slanglucci oppress greatest danger come soon the album https //t.co/moll5vd8yd,1
2041,2931,danger,"Boston, MA",uber look repair recent bad rap nonprofit partnership http //t.co/h1xch54kd3,0
2042,2932,danger,Hailing from Dayton ,i wish i could get victoria 's secret front i 'm good,0
2043,2933,danger,Worldwide,turnedonfetaboo hsjb215 check rockin preview claytonbry danger zone come soon https //t.co/e1wrvyzfkv artistsunit,0
2044,2934,danger,"Newcastle Upon Tyne, England",thetxi gunnersfan89 would arsenal fan want west ham releg battl season danger afc sun,0
2045,2935,danger,Atlanta Georgia ,remainontop fettilootch is slanglucci oppress greatest danger come soon the album https //t.co/moll5vd8yd,0
2046,2936,danger,Atlanta Georgia ,nugget fettilootch is slanglucci oppress greatest danger come soon the album https //t.co/moll5vd8yd,0
2047,2937,danger,,the danger excit underwat cave dive http //t.co/8c3fploxcr http //t.co/cbgz9xun2k,0
2048,2939,danger,,the girl i wan na save like danger health tri somebodi wan na somebodi els,0
2049,2941,danger,Instagram: trillrebel_,gun protect .. that shit realli n't use unless life danger,0
2050,2942,danger,ALWAYS DYING NEVER RESTING,so thirsti yall in danger of dehydr,1
2051,2943,danger,"San Jose, CA",thunderstorm littl rain expect central california high fire danger weather cawx http //t.co/a5gnzbusqq,1
2052,2944,danger,2005 |-/,wan na get danger day tattoo bad cool would spider look like someon wrist smth,0
2053,2945,danger,Israel,in experi re alway angri critic pundit grave danger go rail 1/,0
2054,2946,danger,Uruguay / Westeros / Gallifrey,i danger skyler i am the danger,0
2055,2947,danger,"Kansas City, MO",too danger but 's ok rest us danger https //t.co/yl67dkf4tb,0
2056,2948,danger,"Silver Spring, MD",investig robert mueller n't respond complaint sinc nov 2011 amp left me/son danger http //t.co/pe2d3hcsni,0
2057,2950,danger,Jersey - C.I,honest tho modibo maiga steal live fuck im past best still danger fucktard coyi,1
2058,2952,danger,,fear way make us see danger none contempl logic behind situat find courag engag,0
2059,2953,dead,,joel 2:28 and book act 2:17 http //t.co/rgpem2tqej,0
2060,2954,dead,Afghanistan,17 dead afghanistan aircraft crash an afghan militari helicopt crash remot region ... http //t.co/ki9ehjhl8i,1
2061,2955,dead,Sweden,silent0siri even awesom nors landscap load atmospher life boring/dead snotgreen wasteland =/,0
2062,2956,dead,,miss longer hair .. dead anyway n't even hair,0
2063,2957,dead,,cjban 4sake argsuppos pre-born attain individl rights.gener courtof law forbid kill unless dead person someth,0
2064,2959,dead,London,rememb time goku gave life dead birb hell goku,0
2065,2960,dead,"Orlando, FL",naaa i bee dead .. like legit zombi .. i feel everi sore part bodi https //t.co/j4fsdpfa63,0
2066,2963,dead,,we happen get road right behind buse i 'm dead serious,0
2067,2965,dead,Atmosphere,lmfao fuck lui hhahaha im dead,0
2068,2969,dead,,i watch emmerdal nd i n't know slight attract man name ross got beat nd 's dead,1
2069,2970,dead,Glasgow,soapscoop need confirm ross dead caus dont trust anyon els yh,0
2070,2971,dead,,gailsimon iwasdisappointedbi telltal 's the walk dead good charact amp stori real gameplay mani perform issu,0
2071,2973,dead,,beforeitsnew hundr fear dead libyan migrant boat capsiz rescu û_ http //t.co/mjoeebdlxn http //t.co/fven1ex0p,1
2072,2974,dead,somewhere in Portugal,if itûª war came see never see wave white flag front i canûªt end dead i wont misl,0
2073,2975,dead,South Stand,jones94kyl oh fuck sake dead,0
2074,2976,dead,dundalk ireland,emmerdal ross realli dead askcharley,0
2075,2980,dead,,don avoid wear dead black flame red stark white much esp debat go blue gold brown even shoe,0
2076,2982,dead,,perspect grate dead critic write contribut studi http //t.co/fmu0fnumxf http //t.co/aggryhvxkr,1
2077,2983,dead,"Sochi, KDA, RU",hlportal hello i 'm look mod cold ice i saw site link download dead mayb share thank,0
2078,2984,dead,"ÌÏT: -26.695807,27.837865",kg4vaal lmaov.v hard ny new trend babalmao ... welcom nyozi kwaaaaa dead,0
2079,2987,dead,South Stand,jones94kyl i ve said 's dead one els die,0
2080,2988,dead,You're not 19 forever   ,is ross dead noooooooooooo mikeparractor,0
2081,2990,dead,"Kettering, OH",think time friend bail nite b4 dead show ... went alon amp great time all alon free danc front row,0
2082,2991,dead,United States,typhoon soudelor take dead aim taiwan http //t.co/bhsuxvq6nf,1
2083,2992,dead,,askcharley emmerdal how emot ross dead emmerdal 5,0
2084,2993,dead,Planet Earth,man found dead demi moor 's swim pool http //t.co/octnpyueei,1
2085,2995,dead,Spare 'Oom,'s val dead im su,1
2086,2998,dead,,atchisonsean dead,0
2087,3000,dead,United States,wyrmwood road dead 2014 fuck awesom awesom end awesom one,0
2088,3001,dead,Milton Keynes ,ca n't believ ross dead emmerdal mikeparractor emmerdal summerf,0
2089,3003,death,,i call text 2 nigga bff amp boyfriend i love boy death no nigga hold attent like,0
2090,3004,death,ATL??AL??,i hate to talk otp with my grandma ... i mean i love her as to death but she talk so damn much ssshhheeesshh,0
2091,3005,death,UPTOWN ,until death i ll forev rep jet,1
2092,3006,death,,vibrat shape vape done bust,0
2093,3009,death,PROV,death threat nigga life well gon see,0
2094,3010,death,"Novi, MI",adult die plagu colorado http //t.co/yohvuwumz,1
2095,3011,death,New York,xbox 360 pro consol red ring death full read ebay http //t.co/5gktshiorr http //t.co/9jeuu86koi,0
2096,3012,death,"Buenos Aires, Argentina",go back gainesvill death,1
2097,3013,death,on the go,a year later ferguson see chang ask itûª real http //t.co/h9vmmdebdx,0
2098,3014,death,,papiichampoo what i enjoy obama era civil prez say gop support iranian death ... http //t.co/jpu3es746i,0
2099,3015,death,,i feel like death,0
2100,3016,death,The UK,i like youtub video jeromekem http //t.co/nq89drydbu dj hazard death sport,0
2101,3018,death,,i tell cousin i n't wan na hang text say we re come honest death wish,0
2102,3019,death,,rss judg order texa recogn spous same-sex death certif http //t.co/tziolfte5i,0
2103,3021,death,mpls. ,loyalti mission involv kick shitti nobleman death i love elven weirdo,0
2104,3022,death,"Kensington, MD",http //t.co/lma39zrwoy there way seemeth right unto man end thereof way death,1
2105,3023,death,Buffalo/DC,kellkan thank i narrowli avert death fun re right,1
2106,3025,death,,https //t.co/ecmujkkqx1 arianagrand screamqueen katherin 's death,0
2107,3026,death,"Sylacauga, Alabama",allahsfinest12 ... death muslim,1
2108,3027,death,,go starv death,0
2109,3029,death,,ted cruz bash obama comparison gop to iranian shout death to america http //t.co/cufgvupkzi,0
2110,3030,death,,https //t.co/oifn28hpc arianagrand screamqueen katherin 's death,0
2111,3034,death,,new crime know right punish death,0
2112,3036,death,USA,i issu upload death to smoochi awaken clip youtub reason bicentenni man pain ass,0
2113,3037,death,To The Right of You!,ted cruz bash obama comparison gop to iranian shout death to america http //t.co/txetcysm1h tcot,1
2114,3038,death,Cyprus,cyprus news analysi mullah omar 's death may split taliban 's rank .. omar 's demis would certain lead ... http //t.co/ajkmcuswho,1
2115,3039,death,kansas,i feel like death ... holi moli,0
2116,3042,death,"Los Angeles,CA, USA",video slain mexican journalist unknow predict his own death http //t.co/qxhowcv16r via breitbartnew,0
2117,3043,death,"Portland, OR",there old ladi rockin death metal sedan downtown smoke cigarett i found real mom,0
2118,3044,death,Carry On Jutta!!!,afghan peac talk doubt mullah omar 's death financi time mullah,0
2119,3045,death,Home of the Takers.,y'all pusssssssssi and shoook to death of me,0
2120,3047,death,"New York, New York",the first trial death cecilthelion postpon http //t.co/fnmje8gf7m http //t.co/nye8ae2ifr,0
2121,3048,death,,53 year ago week anniversari marilyn monro 's death ripriprip,0
2122,3049,death,?s????ss? a?????,ari 's hint snippet death,0
2123,3051,death,Chicago,tomorrow death,0
2124,3052,death,"Alicante, Spain",new nyc legionnair diseas death toll rise http //t.co/nql21ajmiv follow http //t.co/18xq3fmug,1
2125,3053,deaths,,vaxshil 2 death measl complic 10 yrs everyon loos shit 8 dead legionnair month amp cricket,1
2126,3054,deaths,,bigamist û÷firstûª wife charg death û÷secondûª pregnant wife child 8 mother nephew 1 uû_,0
2127,3055,deaths,"Mooresville, NC",n't get i77 south ... huge wreck airlift mayb death interst complet block,1
2128,3056,deaths,"Mooseknuckle, Maine",ûï lolgop 2.2 case voter fraud year we need new law 83 gun death day who actual follow law amirit vra50û,1
2129,3057,deaths,"Palermo, Sicily",silenc palermo shipwreck children death http //t.co/tm9zbhjcyf,1
2130,3058,deaths,,this bsf jawan die fidayeen ak bloodi insa insa rifl blame soldier death mod http //t.co/1lk1eqwyuw,1
2131,3059,deaths,AsunciÌ_n-PY / TÌ_bingen-GER,breast milk origin superfood rate worldwid stall 40 contribut 800000 child death last year,0
2132,3060,deaths,"Voorhees, NJ",1/2 death red-light run crash pedestrian bicyclist amp vehicl occup hit red-light runner,1
2133,3061,deaths,,rt truediagnosi 250k death per year physician error http //t.co/dutyzqr2p7åê how avoid one http //t.co/oznsxxvxû_,1
2134,3062,deaths,,cdcwhistleblow 2 death measl complic 10 yrs everyon loos shit 8 dead legionnair month amp cricket,1
2135,3064,deaths,,bigamist first wife charg death second pregnant wife child 8 ... http //t.co/dlaub2nvtn news,0
2136,3066,deaths,UK,500 death year foodborn ill ... frackfreelanc dear ... deccgovuk frackfree_eu tarleton_sophi http //t.co/jsccx8k0ja,1
2137,3068,deaths,"Atlanta, GA",hear drfriedencdc talk avoid thousand resist infections/death next 5 yrs http //t.co/niv8x5tbe0 adiossuperbacteria,0
2138,3070,deaths,Planet Earth,ironi die thousand death http //t.co/dbu30obdxz,0
2139,3071,deaths,Wakanda,strickskin nickscom lol usual i 'm object mayb uncl ben cours most death end busi usual,0
2140,3072,deaths,Lagos,comment death older children data tell us http //t.co/p8yr2po6jn nghlth,1
2141,3073,deaths,Does it really matter!,death 7 http //t.co/xrja0xpl40,1
2142,3074,deaths,,eazzy_p never know would happen govt seem think belief warrant death innoc jap,1
2143,3075,deaths,Your screen,real magic real life women went miss ohio town focus fbi probe strang death ... http //t.co/6m0ynjwbc9,1
2144,3077,deaths,"Phoenix, AZ",no two case n't constitut epidem http //t.co/jblrrnmdsm plagu health publichealth,1
2145,3079,deaths,Does it really matter!,death 3 http //t.co/napviygkyk,0
2146,3080,deaths,Edinburgh,had lunch stewart amp julian coupl hour earlier good final find happen http //t.co/anp9g6njfd,0
2147,3082,deaths,Weyburn,weyburn polic warn public fentanyl death provinc http //t.co/8bqjtp6id5 http //t.co/8kjs7zqaj,1
2148,3083,deaths,UGA '15 Alumnus - Economics ,none annoy crusti all live matter head ass peopl ever actual support caus hate black death get attent,0
2149,3084,deaths,,it 's time to reduc gun death http //t.co/iladqebxpn,1
2150,3085,deaths,,gregorysand usdot amp stat high auto death appli children vehicl i guess run lightrail better adult,0
2151,3086,deaths,Blackpool,cancer equat around 25 death blackpool kow sign could save life http //t.co/5lnidvobff beclearoncanc,1
2152,3089,deaths,"the void, U.S.A",highqualitybird revers situat lol i n't know 9/11 us civilian death specif util make polit,1
2153,3090,deaths,london town..,heard there two death murder chrissi kill adam val finn die emmerdal,0
2154,3091,deaths,Tennessee/Gallifrey,mathew_is_angri z3ke_sk1 saladinahm die horribl death trap ship knew risk,1
2155,3092,deaths,"Amman, Jordan",fco minist tobias_ellwood condemn attack mosqu saudi arabia result least 15 death http //t.co/c3w95h0ozz,1
2156,3093,deaths,Blackpool,cancer equat around 25 death blackpool kow sign could save life http //t.co/11dvqjvxpo beclearoncanc,1
2157,3095,deaths,"Washington, D.C.",critter climat two plagu death colorado http //t.co/dxkt2shuj2,1
2158,3097,deaths,,sinc 1940 year angela sander born roundhous kick relat death increas 13000 percent,1
2159,3099,deaths,"Columbia Heights, MN",walmart take step keep children safe hot vehicl take look innov car seat http //t.co/z3nevglufm,0
2160,3100,deaths,Top Secret,as 2010 17 beluga death report seaworld averag age 15 1/2 year opseaworld http //t.co/mzk5ujlfcv,1
2161,3101,deaths,"ÌÏT: 10.614817868480726,12.195582811791382",bigamist first wife charg death second pregnant wife child 8 moth ... http //t.co/rteugb5tnv,1
2162,3102,deaths,Top secret bunker ,mayoroflondon pls reduc cyclist death compulsori highway code test everi other vehicl use road notrocketsci,1
2163,3104,debris,"Belbroughton, England",aerospac exec plane debri miss mh370 part aircraft wing found reunion island th ... http //t.co/s2wm8lh7oo,1
2164,3105,debris,,malaysia airlin flight 370 disappear 17month ago debri found south the indian ocean http //t.co/nrhurysypd,1
