,id,keyword,location,text,target
3780,5368,fire%20truck,,wild night villag pugwash everi fire truck town like fire truck everi hous -population:6,1
3781,5371,fire%20truck,Here & There,an 18-wheeler came along struck fire truck spin around 180 degre caus roll http //t.co/kmpfhglhoo,1
3782,5372,fire%20truck,District 12 - Orange County,sigalert updat 3 n-133 close at 5 fwi ufn trash truck fire,1
3783,5373,fire%20truck,Plain O' Texas,brooktekle_ n't look like murder scene 1 cop fire truck 2 fire assist car along helicopt,1
3784,5375,fire%20truck,SouthEast Asia,former township fire truck use philippin langley time http //t.co/l90dcpv9zu philippin,1
3785,5377,fire%20truck,,former township fire truck use philippin township langley assist fire chief pat walker spen ... http //t.co/r6yjw4xcki,1
3786,5378,fire%20truck,,our garbag truck realli caught fire lmfao,0
3787,5379,fire%20truck,,kapokekito northgat taco truck 's fire,1
3788,5380,fire%20truck,,it 's never good sign pull work amp 's five ambul amp fire truck bay wompppp least 's friday,1
3789,5381,fire%20truck,"Saipan, CNMI",fire truck ambul k3 phase 3 hope everyon 's okay prayforsaipan,1
3790,5382,fire%20truck,"Orange County, Calif.",sigalert north amp southbound 133 close btwn 5 fwi irvin blvd due truck fire chp detour traffic,1
3791,5383,fire%20truck,lost in my thoughts,eeenice221 true truck caught fire,1
3792,5384,fire%20truck,,justinejayyy ohgod xd i n't mean =p but fire truck back make good xd,0
3793,5385,fire%20truck,Five down from the Coffeeshop,came across fire video mine .. enjoy .. babe way say hi 's fire truck fireman û_ http //t.co/v5gtunwohi,0
3794,5386,fire%20truck,Los Angeles,133 n past 5 l lane reopen all lane close all lane open 133 s. trash truck fire cleanup knx1070,1
3795,5387,fire%20truck,"Orange County, CA",sigalert north amp southbound 133 close btwn 5 fwi irvin blvd due truck fire chp detour traffic,1
3796,5389,fire%20truck,Five down from the Coffeeshop,found cool photo mine 1952 dodg wayn bodi 4 window bus ex libbi mt fire depart truck all oriû_ http //t.co/mcejzzxgh8,1
3797,5391,fire%20truck,,trident 90225 chevi fire truck w/ pumper im fire dept red ho 1:87 plastic http //t.co/faqnfupegn http //t.co/mqfofkxtyh,0
3798,5392,fire%20truck,"Tallahassee, FL",toddler bed firetruck bundl fire truck firefight sticker decal sign wall http //t.co/ykuauov9jo,0
3799,5396,fire%20truck,,monster truck racer catch fire fair,1
3800,5397,fire%20truck,"Laguna Beach, Calif. ",truck fire clog canyon road http //t.co/jrdwyy0ax4,1
3801,5400,fire%20truck," Nevada Carson City,Freeman St",rgj truck trailer catch fire reno http //t.co/kaf3wdrmtn,1
3802,5403,fire%20truck,,philippin former township fire truck use philippin û_ emerg equip cebu philippi ... http //t.co/al28rvkqpq,1
3803,5404,fire%20truck,LA ??,there fire truck park lot,0
3804,5406,fire%20truck,,even sun articl nno http //t.co/7cmf3noync,0
3805,5407,fire%20truck,,choos happi fire truck rest http //t.co/tamrcwfygd review kick push jaymcleanauthor,0
3806,5408,fire%20truck,,former township fire truck use philippin langley time http //t.co/imilsfxntf filipino,0
3807,5409,fire%20truck,,jacksonvill fire amp rescu engin 58 awesom truck offici jade fl ... https //t.co/ybdsljw7c1 via youtub,1
3808,5410,fire%20truck,Aracaju - Sergipe,njturnpik å_ njturnpik reopen hour after truck fire in http //t.co/oabjztbvyz http //t.co/gpbxrrdc07,1
3809,5411,first%20responders,,lukebox someth first responders/ militari true hero 's besid music,0
3810,5412,first%20responders,"Nashville, Tennessee",i 'm grate first respond mnpdnashvill nashvillefd other act swift save countless live today,1
3811,5413,first%20responders,Texas,usatoday pray for god 's heal and safeti of first respond,0
3812,5416,first%20responders,Long Eaton åá Derbyshire åá UK,join chariti 10k run event doningtondash 11am start sun 20 sept 2015 castl donington communiti first respond https //t.co/g1nw99yj8u,0
3813,5417,first%20responders,WorldWide,love way book written includ mani vantag point first respond detkenlang kindl http //t.co/kcrnmjkj73,0
3814,5418,first%20responders,,first respond would never sent wrong address w/ smarttek 's gps-base panic button mper safeti http //t.co/3oionqlfql,0
3815,5420,first%20responders,"Portage, IN / Worldwide",û÷we can helpûª say denver firefight work to curb first respond suicid http //t.co/wtafaepukz,1
3816,5423,first%20responders,"Victoria, BC  Canada",what 's cool teen becom i like call digit first respond friend need littl help support,0
3817,5425,first%20responders,,carmik cinema antioch shoot we are grate staff first respond safeti is highest prioriti http //t.co/behfhsppud,1
3818,5426,first%20responders,Roads/Trails Everywhere,rt roadid thank alex stori amp first respond need û_ http //t.co/hikdc1fm2f,0
3819,5428,first%20responders,New York City,i ad sandi first respond lost their home vip home page group vimeo https //t.co/lkxi6uxjaq,1
3820,5430,first%20responders,"Nashville, TN",thank first respond especi mnpdnashvill life save respons today antioch,1
3821,5432,first%20responders,,juneau empir first respond turn nation night out http //t.co/94uyt4ojyk,0
3822,5437,first%20responders,"Liberty Township, Ohio",red i n't throw word hero around light ... usual reserv first respond militari ... but 's hero ...,0
3823,5439,first%20responders,Aberdeenshire,us want futur first respond high-tech http //t.co/1vi2rnbk2i,0
3824,5442,first%20responders,"Los Angeles, CA",there 's still room parti first respond around countri 3rd annual best ever http //t.co/mnh6fxhodb,0
3825,5443,first%20responders,A Hoop Somewhere,incas accid first respond would know babi present https //t.co/snaymldiun,0
3826,5444,first%20responders,Michigan,kirsten gillibrand http //t.co/amea3lamdj extend health care to 911 first respond,1
3827,5445,first%20responders,"Bloomington, Indiana",we can help say denver firefight work to curb first respond suicid http //t.co/avv6hpnpch,1
3828,5446,first%20responders,USA,first respond conven nation summit award gis technolog http //t.co/0t9yd557ri gisuserpr geotech,0
3829,5448,first%20responders,,york co. first respond compet save live û÷badg bloodûª paramed em http //t.co/e65v80fcus,0
3830,5449,first%20responders,"Washington, DC",some good info help first respond cope- individu resili factsheet responders- http //t.co/fcfpijiqt5,0
3831,5450,first%20responders,,iafflocal4416 live lost except first respond public re charg protect,1
3832,5452,first%20responders,"Basking Ridge, NJ",first respond get int bridgeportspe free saturday detail http //t.co/dih1tgqhej,0
3833,5454,first%20responders,"Stalybridge, Tameside",at 999day emerg servic display meet brave polic firefight first respond help keep us safe,1
3834,5455,first%20responders,,this week first respond dart member particip four day intens technic larg anim ... http //t.co/tl93aod3,1
3835,5458,first%20responders,"Sacramento, CA",as firefight make gain rockyfir jerri brown head area meet first respond tomorrow morn,1
3836,5459,first%20responders,"Franklin, TN near Nashville",after shoot event theater starbuck give free coffe first respond polic amp firefight antiochhickoryhollow tn,1
3837,5460,first%20responders,"St. Louis, Missouri",no lender fee for veteran or first respond past and present linkedin https //t.co/9pmbtxmoal,0
3838,5461,flames,Bandung,new giant flame giant full black pantofel info/ord sms:087809233445 pin:23928835 http //t.co/dthneezup pic.twitter.com/pnpizodi,1
3839,5462,flames,New York,new snap on tool black basebal hat/cap silver/gray embroid s logo flame full reû_ http //t.co/mo7dbbdfvr http //t.co/0scnwe8xbv,0
3840,5465,flames,New York,new snap on tool black basebal hat/cap silver/gray embroid s logo flame full reû_ http //t.co/u3wao8asfg http //t.co/hc6hzs4wsi,0
3841,5466,flames,"Louisville, KY ",vampiro go tabl flame ultimalucha luchaunderground elreynetwork http //t.co/ox6ouw3yut,0
3842,5467,flames,,cabin fever 2 flame https //t.co/yxnagsqvbm,0
3843,5468,flames,"Manhattan, NY",if ca n't summon flame direct hell store bought fine'-m mom- die,0
3844,5469,flames,Freeport Ny,just ad fire flame saturday rick wonder spin guest set along chachi ... http //t.co/otblb9pj2i,0
3845,5471,flames,650/559,kelworldpeac taxston yoga flame,0
3846,5473,flames,,sbnation flame what make good penalti killer http //t.co/xyi5fdacxo http //t.co/sjtvzggcxu,0
3847,5475,flames,dreamy lake,guess say ig 's hope went flame,0
3848,5476,flames,,i ll cri piti parti 's flame,0
3849,5477,flames,houstn,new lil b x chanc noth flame,0
3850,5479,flames,hell,gilderoy wish good enough add flame nail im fire,1
3851,5480,flames,"Asheville, NC",my gang walk round with them brown flame amp that 100nd,0
3852,5481,flames,New York,new snap on tool black basebal hat/cap silver/gray embroid s logo flame full reû_ http //t.co/htqvf44uq http //t.co/pvxelxcjeu,0
3853,5482,flames,St. Patrick's Purgatory,tadhgtgmtel dude smoke fuck thing went flame though bomb went omg scare,1
3854,5484,flames,,maryland mansion fire kill 6 caus damag plug christma tree report say into flame ... http //t.co/ucudwiu3an,1
3855,5485,flames,@cockerelshoes,new giant flame giant man brown info/ord sms:087809233445 pin:2327564d http //t.co/t1mbw0ia3o http //t.co/clfa0py5lm,0
3856,5486,flames,United States,ûïyou see devast amp itûª shocking.ûï firefight continu battl flame california benstraci report û_,1
3857,5487,flames,manaus,watch go flame,1
3858,5488,flames,"Sioux Falls, S.D. ",rp said see smoke come silo 260th street hartford flame,1
3859,5489,flames,,i chose search joy two us weûªll near smile matter cold flame burn bod portgassdk,0
3860,5491,flames,Republica Dominicana,maryland mansion fire kill 6 caus damag plug christma tree report say into flame firefight 's braveri ...,1
3861,5492,flames,"Eastlake, OH",erinmariefishi everyon set flame upon,0
3862,5493,flames,"Hillsville/Lynchburg, VA",flames_n 's optimist side no doubt 's tough but done i feel like game pivot defens,0
3863,5494,flames,U.S.A,maryland mansion fire kill 6 caus damag plug christma tree report say into flame ... http //t.co/p1wmkxa9d8,1
3864,5495,flames,Some where,so pardon i burst flame i ve enough world peopl 's mindless game,0
3865,5496,flames,Travelling around the world ,awickedassassin want burst flame anna hug tight,0
3866,5497,flames," 616 Û¢ Kentwood , MI ",selmoooooo _edvinnn imtariik dzafic_hari selmo u catch flame im gon na wit slaughter,1
3867,5498,flames,,bloodi ell let burn rubybot,0
3868,5499,flames,,if opinion n't put thh internet furst flame,0
3869,5501,flames,? Jet Life ?,i rise follow graph 2 follow past week get stat right http //t.co/ulxf6dq3n,0
3870,5502,flames,Fairy Tail! ,aisumag akumareisu -- gray ophelia red flame blaze around person set near everyth area --,1
3871,5503,flames,Santo Domingo Alma Rosa ,soloquiero maryland mansion fire kill 6 caus damag plug christma tree report say into flame firefight ...,1
3872,5505,flames,Somewhere Around You,maryland mansion fire kill 6 caus damag plug christma tree report say into flame ... http //t.co/lkjfabqzb3,1
3873,5506,flames,Houston |??| Corsicana,cw_hoop better make shot tomorrow caus i 'm record flame thrown tomorrow,0
3874,5507,flames,"Cincinnati, OH",i ad video youtub playlist http //t.co/atcmrjzjtp nicki minaj up in flame offici video,0
3875,5509,flames,Bacon,he better sean bro i admit sean flame but better sean https //t.co/aomq1rykmj,0
3876,5510,flames,,the advantag apropo flame favor regard mississauga ontario pwhvgwax,0
3877,5514,flattened,Some other mansion,flatten cartoony-lik whoa papa https //t.co/4zmcqrmoi,0
3878,5515,flattened,Chicago,road success pave penni i flatten train track re welcom,0
3879,5517,flattened,"Astley, Manchester",feel like i ve flatten sumo wrestler pain gain muaytai wantmyabsback strong,0
3880,5518,flattened,"Bow, NH",idea in food flatten http //t.co/qfrawln4ba,0
3881,5519,flattened,Leicester,zouma flatten cfc,0
3882,5520,flattened,"Frome, Somerset, England",zouma absolut flatten guy,0
3883,5521,flattened,Mars,flatten https //t.co/9jcibenckz,0
3884,5522,flattened,"Melbourne, Victoria",70 year ago first atom attack flatten hiroshima 3 day later nagasaki war crime put moscow place,1
3885,5524,flattened,UK,today august 6th 70th anniversari a-bomb littl boy drop hiroshima.70000 kill outright citi flatten,1
3886,5525,flattened,"Essex, England",would flatten littl midget https //t.co/bhufevagpu,0
3887,5526,flattened,"new york, ny",said yosemit sam drumpf ûïnobodi û÷ill vote flatten rabbit skin a-huh huh û_ i alway sayû,0
3888,5528,flattened,somewhere too cold for me,grabakahitman izi_garcia flatten machida ... lose fight .. nope lost fight guy n't lost also,1
3889,5529,flattened,Barbados,floored4 flatten earli bird get de cup .... lag bout pun de dock watch ppl drinkû_ https //t.co/r5stv25zhq,0
3890,5531,flattened,,conklin flatten shuffl feet instead kick slide did n't get hand chest http //t.co/67tjn9egyk,0
3891,5532,flattened,Leeds,flatten thee striker,1
3892,5534,flattened,"Wahpeton, ND",pick flatten hay men masonit wahpeton nd https //t.co/kw3vq4nijq,0
3893,5535,flattened,,zouma flatten guy,0
3894,5538,flattened,"Chorley, Lancashire, UK",fyld build set flatten one prestonûª citi centr icon build disappear skylin http //t.co/pdkhbdg9ho,0
3895,5539,flattened,,iamhorsefli hide kid hide wife he 's loos i thought i flatten ball,0
3896,5540,flattened,,would ve great mbiwa flatten littl rat,0
3897,5541,flattened,"Northampton, MA",jimmozel puck=flatten ball lol,0
3898,5544,flattened,Ventura,i n't doubt but implicit statement make want flatten bus https //t.co/5hljucxi0,0
3899,5545,flattened,Le Memenet,kainyusanagi grummz pixelcanuck flatten raynor raynor bald imperfect biker marin emo generic western hero,0
3900,5547,flattened,"Lubbock, Texas",seanpeconi jason_floyd lynchonsport criscyborg i think risk lose get nose flatten lot,0
3901,5548,flattened,Derby,mum 's liter pick new car today flatten batteri alreadi tri sort bluetooth muppet,0
3902,5552,flattened,"Mississauga, Ontario",tweetinglew tersestuff notley flatten harper in his heartland harper import ten thousand tfw slave cost albertan job,0
3903,5553,flattened,Delhi ,twilightfairi flatten frog,0
3904,5554,flattened,"Keighley, England",imagin get flatten kurt zouma,0
3905,5555,flattened,Pomfret/Providence,the fallaci steam roller it 's object whether flatten robertcalifornia thereisonlysex,0
3906,5556,flattened,"Baltimore, MD",photo beach earring beach jewelri vacat earring keep calm beach on earring made flatten ... http //t.co/rjebpib5rz,0
3907,5557,flattened,,100 1 mix new flat doubl side linerless bottl cap you choos mix flatten full reû_ http //t.co/w00kjprfdr http //t.co/mixl1pfrj,0
3908,5558,flattened,"East Lansing, MI",bigburgerboi55 flat footbal more like flatten spartan crush back day hail,0
3909,5559,flattened,Rocketing through the galaxy,satanaofhel ever seen far a dreami look came face ear flatten start walk slowli toward you'd-,1
3910,5560,flattened,New York,100 1 mix new flat doubl side linerless bottl cap you choos mix flatten full reû_ http //t.co/wrnpywyalj http //t.co/qv7iydovx9,0
3911,5561,flood,boston,fizzi sit regular flood seat ...... one know .....,0
3912,5563,flood,United States,jkl cancel flash flood warn bell harlan knox ky http //t.co/4ry6zhcpoq wx,1
3913,5564,flood,New York,spot flood combo 53inch 300w curv cree led work light bar 4x4 offroad fog lamp full reû_ http //t.co/xxkhjysn0p http //t.co/jevhknjgbx,1
3914,5565,flood,New York,spot flood combo 53inch 300w curv cree led work light bar 4x4 offroad fog lamp full reû_ http //t.co/jcdd6sd6qn http //t.co/9guckjghm,0
3915,5567,flood,"Warrandyte, Australia",a small flood bigåêconsequ https //t.co/cvpdvhxd1r http //t.co/fdmxp4fcmo,1
3916,5569,flood,"British Columbia, Canada",homecom queen kill way home prom flood water socialnew http //t.co/vmkexjtyg4,1
3917,5570,flood,,2pcs 18w cree led work light offroad lamp car truck boat mine 4wd flood beam full reaû_ http //t.co/vdefmulx43 http //t.co/yqpaijsa5g,0
3918,5573,flood,,it 's rain sinc left now i 'm drown flood you see i ve alway fighter but without i give,0
3919,5575,flood,Aix-en-Provence/Utrecht,creationmin rwrabbit gooneratheist atheistic_1 lolatjesus yet still mani fish die worldwid flood i wonder,0
3920,5576,flood,Philadelphia,and pleas n't flood poor robertbenglund 's mention he 's put work,1
3921,5577,flood,New York,spot flood combo 53inch 300w curv cree led work light bar 4x4 offroad fog lamp full reû_ http //t.co/mtmoia0oo0 http //t.co/nn4ztcmsru,0
3922,5578,flood,"Van Buren, MO",atlarnxx didnt,0
3923,5579,flood,New York,12 72w cree led work light bar alloy spot flood combo dive offroad 4wd boat full readû_ http //t.co/xwn7rgvkzc http //t.co/swpdq84boi,0
3924,5580,flood,New York,2pcs 18w cree led work light offroad lamp car truck boat mine 4wd flood beam full reaû_ http //t.co/apwxs5mm44 http //t.co/ds76lozlsu,1
3925,5581,flood,"Niagara Falls, Ontario",hellotybeeren cue flood peopl iron call,0
3926,5582,flood,USA,motor hot deal 452 gt gt http //t.co/ed32pbvio7 10x 27w 12v 24v led work light flood lamp tractor truck suv utv aû_ http //t.co/ifm6v6480p,0
3927,5584,flood,,85v-265v 10w led warm white light motion sensor outdoor flood light pir lamp auc http //t.co/njvpxzmj5v http //t.co/ijd7wzv5t9,0
3928,5586,flood,Hawaii USA,iembot_hfo at 10:00 am 2 nnw hana maui co hi counti offici report coastal flood û_ http //t.co/gg0dzsvbz7 http //t.co/kbe91arcdw,1
3929,5587,flood,New York,1 pair new 27w 4 '' round led work drive flood light off-road atv utv full read ebay http //t.co/d3p88xdlec http //t.co/j2ddvh7fy0,0
3930,5588,flood,New York,2pcs 18w cree led work light offroad lamp car truck boat mine 4wd flood beam full reaû_ http //t.co/o1smuh2unn http //t.co/xqj6wgiuqh,0
3931,5589,flood,,internet basic flood defect intertissu soul mate milk trench host guabxfv http //t.co/uzsqzycb8x,1
3932,5590,flood,,bmx issu areal flood advisori shelbi al till aug 5 9:00 pm cdt http //t.co/62oddekvli,1
3933,5592,flood,New York,2pcs 18w cree led work light offroad lamp car truck boat mine 4wd flood beam full reaû_ http //t.co/1qt51r5h98 http //t.co/oqh1jbuenl,0
3934,5593,flood,USA,flood advisori effect shelbi counti al 9 pm alwx http //t.co/gtqmgsgcsb,1
3935,5594,flood,United States,rt grant_factori grant fund weymouth meet seawal flood grant set thursday night û_ http //t.co/th2wlilbmo,1
3936,5595,flood,New York,spot flood combo 53inch 300w curv cree led work light bar 4x4 offroad fog lamp full reû_ http //t.co/5xmce6juf http //t.co/3zo7px3p1v,0
3937,5598,flood,New York,spot flood combo 53inch 300w curv cree led work light bar 4x4 offroad fog lamp full reû_ http //t.co/o097vsotxk http //t.co/i23xy7iejj,0
3938,5599,flood,New York,spot flood combo 53inch 300w curv cree led work light bar 4x4 offroad fog lamp full reû_ http //t.co/fdsaooiskj http //t.co/2uvmq4vafq,0
3939,5600,flood,United States,flood advisori issu august 05 4:28pm edt nws http //t.co/d02sbm0oj wxki,1
3940,5602,flood,,surviv plagu float flood peek head mud one 's immun deafen bell god surviv,0
3941,5603,flood,New York,spot flood combo 53inch 300w curv cree led work light bar 4x4 offroad fog lamp full reû_ http //t.co/6zcfhi7srw http //t.co/vwykdau1vm,0
3942,5604,flood,USA,flood prone waterway in westchest counti now elig for million in state aid newyork http //t.co/xsr2vujyiz,1
3943,5605,flood,Waddesdon,chines rescu team arriv myanmar help flood victim http //t.co/nosvu0zx4x sittway http //t.co/5mjzjnkpfn,1
3944,5608,flood,"Knoxville, TN",flood advisori issu august 05 7:10pm cdt august 05 8:00pm cdt nws ... the urban and ... http //t.co/semw5cq7dg weather,1
3945,5609,flood,New York,12 72w cree led work light bar alloy spot flood combo dive offroad 4wd boat full readû_ http //t.co/mjmwa72er6 http //t.co/adx9iyi246,0
3946,5611,flooding,"Rock Springs, WY",rock spring ûò resid live elk street continu battl flood issu mondayûª rain storm whileû_ http //t.co/8j19fvu7qa,1
3947,5612,flooding,Vietnam,cuban leader extend sympathi vietnam flood http //t.co/xlq8g6vb2r,1
3948,5613,flooding,"Tampa-St. Petersburg, FL",busi spong dock wash rain flood http //t.co/5pmikavykl,1
3949,5614,flooding,,warlord_queen thrust littl jam cock deep insid flood womb pussi hot thick cum,0
3950,5617,flooding,USA,sever thunderstorm flash flood possibl mid-south midwest http //t.co/uahicwpih4 weather environ climat natur,1
3951,5618,flooding,"Huntsville, Alabama",11:30a radar updat widespread showers/storm move areas-minor flood possibl hunwx http //t.co/e3l1jqjh2u,1
3952,5619,flooding,"Nova Scotia, Canada",tip prevent basement leak creat control joint elimin random crack homeimprov flood http //t.co/kx8cu4s8t1,0
3953,5620,flooding,,flood http //t.co/wveo9ed10,1
3954,5621,flooding,Metro Manila,adorableapppl no report flood po area ten-4 mmda,0
3955,5622,flooding,,flood kill 166 displac one million pakistan daili news amp analysi http //t.co/9mj8ouj3vt yugvani,1
3956,5624,flooding,Breaking News,flood kill 166 displac one million pakistan daili news amp analysi http //t.co/kkoovbkndp,1
3957,5625,flooding,Jakarta/Kuala Lumpur/S'pore,lao flood -10 villag underwat world vision respond http //t.co/8fvqrizoux,1
3958,5626,flooding,UK,flood ukflood british trekker rescu amid flash flood himalaya a group british tr ... http //t.co/nsfzkfgznj flood,1
3959,5627,flooding,,slopeofhop mayb plan dilut safe say we start charg 's long would come flood,0
3960,5628,flooding,Vietnam,cuban leader extend sympathi vietnam flood http //t.co/qcyxwr2rdv,1
3961,5629,flooding,,ill onli dm hotel info becaus peopl are flood my notif ask me for info,0
3962,5631,flooding,I ACCEPT SONG REQUESTS,when wave flood shore and i ca n't find way home anymor that 's i look http //t.co/tdaktglu5p,1
3963,5632,flooding,"Honolulu, Hawaii",if flood occur home how stop mold growth via proudgreenhom http //t.co/kavaovjz2v,1
3964,5633,flooding,,http //t.co/xjkrxrnwnv flood track caus derail sa insubcontin insubcontin http //t.co/jlwgshyy3n,1
3965,5634,flooding,"Miami Beach, Fl",the chines flood nyc market like never http //t.co/9z9hsmiavd,0
3966,5635,flooding,Republic of Texas,obama keep 27 iraqi christian asylum seeker ndetent while flood u.s. w/unscreen muslim http //t.co/b4k0r4gga8 via dcclotheslin,1
3967,5638,flooding,"California, USA",so grate support flood netkicorp dinner guest thank you all https //t.co/eltne5v1qn,1
3968,5641,flooding,Huntsville AL,there flash flood madison valleywx,1
3969,5642,flooding,? ,themain soon start flood comment section come brazil comment bc,0
3970,5644,flooding,don't run,and last year lot the drum are flood janic i 'm fall,0
3971,5645,flooding,West Midlands,ûï bbcengland a burst water main caus major flood birmingham hospit http //t.co/q4kgftc2am http //t.co/6w6a2l4qaeû omg,1
3972,5646,flooding,Jakarta/Kuala Lumpur/S'pore,heavi rainfal flood northern vietnam situat report no.2 http //t.co/hvxu1zcvau http //t.co/ijmccmhh5g,1
3973,5647,flooding,,crabbycal oh my god the memori are flood back,0
3974,5650,flooding,Global-NoLocation,flood disast burst water pipe flood apart nycha senior center ny1 ny1burst water pipe flood a ... http //t.co/w7siidujoh,1
3975,5651,flooding,,lrt look at all my tom feel flood back,0
3976,5652,flooding,Jakarta/Kuala Lumpur/S'pore,myanmar msf assist thousand worst flood decad hit part myanmar http //t.co/pijg5w2l2u,1
3977,5653,flooding,"Ocean City, NJ",resid central part ocean citi heard engin flood mitig option tuesday ocnj ... http //t.co/jzprciqa9d,1
3978,5654,flooding,,wen i final get girl i want i 'm flood yall wit pic us rs tho,0
3979,5655,flooding,belleville,kwislo i see flood mad decent,0
3980,5656,flooding,"Kualar Lumpur, Malaysia",monsoon flood kill dozen in myanmar prompt call for help http //t.co/r7vpaklhvi,1
3981,5657,flooding,"Austin, TX",memori unveil travi counti deputi kill sept. flood travi counti sheriff greg hamilton joinedû_ http //t.co/eo2f96wxpz,1
3982,5658,flooding,,flood kill 166 displac one million pakistan http //t.co/icfql7i9op at least 166 peopl kill near 11 lakhû_,1
3983,5659,flooding,"Nadiad ,Gujarat , India!!",thankkk u soo much flood notificationsu fella parshol r superb amp jus soo awesomelov love u all alway frvrgrate,0
3984,5661,floods,South of D.C.,slip slide away flash flood info writer w/toni nester sonoranrattl writingtip http //t.co/slttorrlh,1
3985,5662,floods,,who bring tornado flood who bring climat chang god america he plagu farrakhan quot,1
3986,5663,floods,Adventist - Lesson Sabbath,myanmar flood heavi monsoon rain month juli caus flood flash flood landsli ... http //t.co/9tg7a5oqfp,1
3987,5664,floods,Australia,in india 119000 peopl taken shelter 966 relief camp govern set flood http //t.co/eu8jypizsd,1
3988,5665,floods,,pmharper n't worri i 'm sure climat noth hail flood tornado alberta amp ontario i 'm sure god 's mad,1
3989,5668,floods,Passamaquoddy,ictyosaur i never thought would wtf moment yet 's month 90 degre heat next flash flood ..,1
3990,5669,floods,Û¢III.XII.MMXIÛ¢,grant like half town flood rain still whatev,1
3991,5670,floods,"Sherwood, Brisbane, Australia",madonnamk rspca site multipl 7 stori high rise build next low densiti charact residenti area flood,0
3992,5671,floods,canada,cyberdemon531 hope mountain dew erod throat flood lung leav drown death,1
3993,5672,floods,Michigan,disast group stun flood http //t.co/jrgj17oamt,1
3994,5673,floods,london,'s person amp reckon re die brain flood dmt caus reliv life real time simul,0
3995,5674,floods,,have ever rememb old song someth n't hear year word carri flood memori along priceless,0
3996,5675,floods,California,flood fish final sunshin amp fab deal albertson anniversari sale |lauren paint beauti life http //t.co/cwhslmb8x9,0
