,id,keyword,location,text,target
5589,7976,razed,,the latest more home raze northern california wildfir http //t.co/2nip3d15dx http //t.co/egyfnlaoqv,1
5590,7977,razed,,the latest more home raze northern california wildfir http //t.co/bsgr67dywi http //t.co/ndggr6xyqd,1
5591,7978,razed,,the latest more home raze northern california wildfir http //t.co/5fcjvml520 http //t.co/fvyrwhux8p,1
5592,7980,razed,North,petereallen huffpostuk bbc5live how signific think icon pic church mayb ruin less substanti effort raze,0
5593,7981,razed,,the latest more home raze northern california wildfir http //t.co/3tnuaciv3c http //t.co/sakorgdqul,1
5594,7982,razed,,the latest more home raze northern california wildfir http //t.co/p3g3bqbczu http //t.co/rpbxdfnx5k,1
5595,7983,razed,,the latest more home raze northern california wildfir abc news http //t.co/x1xj0xvtj7,1
5596,7984,razed,"Ames, IA",davidvonderhaar at least sincer,1
5597,7987,razed,,the latest more home raze northern california wildfir abc news http //t.co/rg9yaybosa,1
5598,7988,razed,,the latest more home raze northern california wildfir abc news http //t.co/2872j5d4hb,1
5599,7989,razed,,the latest more home raze northern california wildfir http //t.co/ecxmoinzgu http //t.co/ntwwdwednb,1
5600,7990,razed,San Diego California 92101,more home raze northern calif. wildfir http //t.co/u52rw9ji2r sandiego http //t.co/gx75w3q9y,1
5601,7991,razed,Nairobi-KENYA,georg njenga hero save burn friend raze wildfir http //t.co/ywkk26arag,1
5602,7992,razed,"Erie, PA",today anoth dualcom im_raz enjoy yesterday check today 5 pm easter,0
5603,7994,razed,,the latest more home raze northern california wildfir abc news http //t.co/bksyymvisg gn,1
5604,7996,razed,,the latest more home raze northern california wildfir abc news http //t.co/rlpttkbg4w,1
5605,7999,razed,,the latest more home raze northern california wildfir abc news http //t.co/6acswzo7cw,1
5606,8000,razed,,the latest more home raze northern california wildfir abc news http //t.co/hckxj8eukt,1
5607,8001,razed,,the latest more home raze northerncalifornia wildfir http //t.co/monijjth7v zippednew http //t.co/0yxbb5dzw5,1
5608,8002,razed,,the latest more home raze northern california wildfir http //t.co/r1cnsjuayq http //t.co/dq1ylcrf9k,1
5609,8003,razed,Nairobi-KENYA,georg njenga hero save burn friend raze wildfir ... http //t.co/us8r6qsn0p,1
5610,8005,razed,,the latest more home raze northern california wildfir http //t.co/irqujaesck http //t.co/qdweknrmi9,1
5611,8006,razed,,the latest more home raze northern california wildfir abc news http //t.co/auezxza5ak,1
5612,8008,razed,"Augusta, Maine, 04330",vassalboro hous raze make way public gazebo petel_mcguir report http //t.co/uuewccdtow,0
5613,8009,refugees,,this just-marri turkish coupl gave 4000 syrian refuge incred gift http //t.co/ibed3xg7fi fed instead famili amp friend,1
5614,8010,refugees,Ad Majorem Dei Glorium,polic monitor 200 jihadi poland http //t.co/1wcofmlub9 via freedomoutpost,1
5615,8012,refugees,"Aurora, Ontario ",turkish newlyw donat wed money beauti gestur still faith human http //t.co/o1enhjrkjd,0
5616,8013,refugees, Baku & Erzurum ,this just-marri turkish coupl gave 4000 syrian refuge incred gift washingtonpost http //t.co/arkmc7vcln,1
5617,8015,refugees,Statute Of Limitations_,repuls refugees-victimiser- dutton evangelical-liar- abbott c/o lnp dupe press overdr chopperg bronwynbishop auspol,0
5618,8016,refugees,paradise,retweet cameroon repatri 12000 nigerian refuge due boko haram http //t.co/wvvgmeja7l,1
5619,8017,refugees," BC, US, Asia or Europe.",newlyw feed syrian refuge wed cbc news latest canada world entertain busi news http //t.co/qu8s89pvvt,0
5620,8018,refugees,,wowo -- === 12000 nigerian refuge repatri cameroon,1
5621,8019,refugees,,..... hmm 12000 nigerian refuge repatri cameroon http //t.co/ytw9slwvmg,1
5622,8020,refugees,,... // .. // whao .. 12000 nigerian refuge repatri cameroon http //t.co/bae0ap4g9i,1
5623,8021,refugees,St PetersburgFL,imagin entir aisl dedic make peopl look like serbian refuge director whole food cloth section,0
5624,8023,refugees,EspaÌ±a,viralspel coupl spend wed day feed 4000 syrian refuge http //t.û_ http //t.co/i1vpkq9yag see http //t.co/ty5gavn7uk,0
5625,8024,refugees,,reaad/ plsss 12000 nigerian refuge repatri cameroon,1
5626,8025,refugees,Tarragona,top stori viralspel coupl spend wed day feed 4000 syrian refugeesû_ http //t.co/a2tiivnjdi see http //t.co/fw2xifj6ec,0
5627,8026,refugees,,refuge connect indiegogo campaign go live tomorrow support us help launch onlin communiti refuge,1
5628,8028,refugees,,y'all read 12000 nigerian refuge repatri cameroon http //t.co/avwe1lbvhn,1
5629,8029,refugees,,short throw overboard i n't think leader could much wors refuge tonyabbottmhr worst pm ever,1
5630,8030,refugees,Warri,cameroon repatri 12000 nigerian refuge http //t.co/6nqru2q5tz,1
5631,8031,refugees,Melbourne Australia,captain abbott must go lnp boat refuge christianvalu https //t.co/kp5dpoaf58,0
5632,8032,refugees,,a turkish coupl spent wed day feed 4000 syrian refuge a turkish coupl got marri û_ http //t.co/igll3ph6o1,0
5633,8034,refugees,"21.462446,-158.022017",how one coupl is use drone save refuge world 's deadliest border http //t.co/9qpg0z3rh9,1
5634,8035,refugees,,... // .. // whao .. 12000 nigerian refuge repatri cameroon http //t.co/huhwpmrywz,1
5635,8036,refugees,,..... hmm 12000 nigerian refuge repatri cameroon http //t.co/96p3hujntj,1
5636,8037,refugees,"Bangalore, India",turkish coupl decid feed 4000 syrian refuge part wed celebr http //t.co/ehlq3zsptd http //t.co/djx5elbrv1,0
5637,8038,refugees,Skyhold,fadelurk dalinthanelan lt right even two year still refuge camp south redcliff villag aidan gt,1
5638,8039,refugees,Australia,newlyw feed thousand syrian refuge instead host banquet wed dinner http //t.co/egcv7ybja age news,0
5639,8040,refugees,"Amman,Jordan",in photo the young refuge forc flee burundi 's violenc vice news https //t.co/jojnq2oopi see http //t.co/dskui6mmgl,1
5640,8043,refugees,tripoli international airport,kristindavi un refuge thank un refuge help mani peopl need world .... https //t.co/ypvjgzqqqb û_,0
5641,8044,refugees,,wowo -- === 12000 nigerian refuge repatri cameroon,0
5642,8045,refugees,,newlyw feed thousand syrian refuge instead host banquet wed dinner http //t.co/xzv0lt9zzk via smh,1
5643,8047,refugees,"Auckland, New Zealand",http //t.co/ehklp12yip paci c media centr articl australia rsf protest new secur gag report ...,0
5644,8049,refugees,,recap/ 12000 nigerian refuge repatri cameroon http //t.co/po19h8ycnd,1
5645,8055,refugees,"NYC,US - Cali, Colombia",the most generous bride earth coupl feed 4000 syrian refuge their wed day http //t.co/ms8e8mnddb via thedailybeast love,0
5646,8056,refugees,,... // .. // whao .. 12000 nigerian refuge repatri cameroon http //t.co/po19h8ycnd,1
5647,8057,refugees,QLD Australia,the 46 return refuge flee amp vietnames govt treat return dutton presser,1
5648,8058,refugees,"Geneva, Switzerland",chpsre rt refuge for follow pari visit a dream human exhibit rezaphotographi û_ û_ http //t.co/rpmtropsvr,1
5649,8060,rescue,Trinidad & Tobago,policyhold object clico rescu plan http //t.co/e4dvi9vuxz http //t.co/jycpf8iyhg,1
5650,8061,rescue,SF Bay Area,do n't panik kelbytomlinson rescu http //t.co/hujvgsflus,0
5651,8062,rescue,#HarleyChick#PJNT#RunBenRun,coastal german shepherd rescu oc share link ... http //t.co/p85nwcmkqu animalrescu https //t.co/wudlkq7ncx,0
5652,8064,rescue,"Toronto, Ontario",ud rescu structur collaps scott road ypres road york 14 truck,1
5653,8065,rescue,New Jersey,rescu day itûª world cat day saturday aug 8th black black/whit cat 5 http //t.co/oqb7dasmvi newbeginningsanimalrescu,0
5654,8066,rescue,Big NorthEast Litter Box,i 'm 2 blood pressur med 's still probabl roof long ppact stori broke i involv anim rescu,0
5655,8067,rescue,Sand springs oklahoma,coastal german shepherd rescu oc share link ... http //t.co/35qwnglko animalrescu https //t.co/is2idc3ubj,0
5656,8068,rescue,,coastal german shepherd rescu oc share link ecstat rescu racco ... http //t.co/t8q6dzvgwx animalrescu,0
5657,8069,rescue,,sugg amp vivian rescu psychrewatch,0
5658,8070,rescue,"Surry Hills, Sydney",ani length rescu cat need http //t.co/amrox4y4nx,0
5659,8071,rescue,Sand springs oklahoma,last chanc anim rescu 3 new post http //t.co/f1tcbg1mki animalrescu https //t.co/is2idc3ubj,0
5660,8073,rescue,#HarleyChick#PJNT#RunBenRun,last chanc anim rescu 3 new post http //t.co/kiildu8gpo animalrescu https //t.co/wudlkq7ncx,0
5661,8074,rescue,,sammi todd alway rescu may uniform still rescu lmao forev kfc fam,0
5662,8079,rescue,USA,lunch crew made night night 's long day ~peace~love~rescue~,0
5663,8081,rescue,Thornton  Colorado,tell unit nation plantat not forest https //t.co/cic7h64qv8 via rainforestresq,0
5664,8083,rescue,Wanderlust,mari come troy rescu https //t.co/rosvxqelqj,0
5665,8084,rescue,"Toronto, Ontario",ud rescu structur collaps scott road ypres road york 14 truck,1
5666,8085,rescue,Karachi,flood-zon general raheel sharif visit chitral he also laud effort fwo armi troop armi aviat rescu opera ...,1
5667,8087,rescue,,last chanc anim rescu 3 new post http //t.co/1eb2dauyfn animalrescu,0
5668,8088,rescue,,lisavanderpump how mani dog rescu dog,0
5669,8089,rescue,India,offici rescu 367 migrant libya 25 bodi found fox news http //t.co/cedcugeuw news,1
5670,8091,rescue,U.S.A.   FEMA Region 5,coastal german shepherd rescu oc share link ... http //t.co/2jxkmkpalp animalrescu https //t.co/ec46lyqqc6,0
5671,8094,rescued,United States,zak_bagan sabrina dad rescu dude kept cage we ve sinc i 4 http //t.co/1k2phqcuw8,1
5672,8095,rescued,,briton rescu amid himalaya flood http //t.co/wgrxly9pdo http //t.co/bj4haavay http //t.co/59p3aoiqus,1
5673,8096,rescued,Nigeria,4 kidnap ladi rescu polic enugu nigerian tribun http //t.co/xyyev89wiz,1
5674,8097,rescued,Jakarta,rescu med migrant arriv sicili http //t.co/z8xiqngulc,1
5675,8098,rescued,"Ohio, USA",tennoatax i hand glass water sit i rescu tenno i ve live ship around dojo year ...,0
5676,8100,rescued,watford,trust us get rescu dopey one val hilari shame 's probabl go die emmerdal,0
5677,8101,rescued,West Hollywood,summer summervib california puppi pitmix rescu brixton banksi happi mybabi https //t.co/7vovktxspo,0
5678,8102,rescued,Kent,man who buri dog aliv thought no one would find her but she was rescu just in time http //t.co/sahq5uoahw,0
5679,8103,rescued,Canada,10-month-old babi girl rescu coastguard she float half a mile out sea socialnew http //t.co/kjuzjc6igd,1
5680,8105,rescued,The Multiverse,but skyrim await rescu ...,0
5681,8106,rescued,USA,rescu med migrant arriv sicili http //t.co/nekm1rpohu,1
5682,8109,rescued,Bournemouth,the finnish hip hop pioneer palefac rescu drift raft brought contain later enkelbiljett menolippu,0
5683,8110,rescued,Jammu | Kashmir | Delhi,18 bovin rescu 3 smugglersåênab http //t.co/e7fn5g5ruu,1
5684,8111,rescued,,fund need rescu abandon cocker spaniel http //t.co/rjrmw7nzy5,0
5685,8112,rescued,,i like youtub video http //t.co/45twhj0l6m romanatwoodvlog rescu sick kitten,0
5686,8113,rescued,,news briton rescu amid himalaya flood http //t.co/kepznhxhxd,1
5687,8116,rescued,southern california,a brave littl dog get rescu river his recoveri inspi ... https //t.co/jywfygclhm via youtub,0
5688,8118,rescued,"Philadelphia, Pennsylvania USA",homeless man travel across usa with 11 stray dog he rescu get a help hand from stranger http //t.co/qhfqlui6ri via reshareworthi,0
5689,8119,rescued,,brittanypetko break news tonight kid rescu play room week food water parent sex life haha,1
5690,8120,rescued,"Winston-Salem, NC",you rescu actual pretend giorgio hiatt,0
5691,8121,rescued,"Huntley, IL",we rescu dog least 9 year ago 's old still sweet ever zak_bagan http //t.co/yhyy3o609u,0
5692,8122,rescued,NIGERIA,http //t.co/qgyn2u1up3 rescu med migrant arriv sicili hundr migrant rescuedû_ http //t.co/wis3h9tqrm,1
5693,8125,rescued,The green and pleasant land.,whi n't taken back africa rescu c4new,1
5694,8126,rescued,Earth,migrant rescu after boat capsiz off libya http //t.co/pmggavtokp,1
5695,8128,rescued,,young children among rescu capsiz boat libya http //t.co/kot9zvd2h7 via irishtimesworld,1
5696,8129,rescued,,hero a springer spaniel amp dog dad rescu strand babi dolphin http //t.co/g03dkpoonp http //t.co/go0hpi0b4c,1
5697,8130,rescued,"Leeds, U.K.",trust us get rescu dopey one emmerdal summerf,0
5698,8131,rescued,Ireland,three beach whale rescu kerri http //t.co/rqbspucjdf,1
5699,8133,rescued,,rescu tb goe ribbon hit http //t.co/pa5sslefec via offtrackhors,0
5700,8135,rescued,,turn back i rescu swept away sin though cloud isaiah 44:22 contemporari english version,0
5701,8136,rescued,"Pennsylvania, USA",zak_bagan pet r like part famili i love animals. the last 2 pet i i rescu break heart anim mistreat,0
5702,8137,rescued,Boston MA,i like youtub video http //t.co/fnpdjwvw1j homeless dog live cardboard box get rescu amp heartwarm,0
5703,8138,rescued,Canada,angri mistrust rescu eleph find peac friendship her new home photo http //t.co/vaunps6wja via onegreenplanet,0
5704,8140,rescued,Jakarta/Kuala Lumpur/S'pore,photo hundr rescu migrant await disembark irish naval vessel palermo itali tconnellyrû_ https //t.co/aim5cyhl0i,1
5705,8141,rescued,Cape Town,rescu med migrant arriv sicili http //t.co/p4doa5yyj,1
5706,8142,rescuers,Nigeria,video we re pick bodi water rescuer search hundr migrant ... http //t.co/bs6pjt09tc africa news,1
5707,8143,rescuers,Westerland,video we re pick bodi water rescuer search hundr migrant mediterran ... http //t.co/s5nuegswyj,1
5708,8144,rescuers,Kuala Lumpur,video we re pick bodi water rescuer search hundr migrant mediterran ... http //t.co/ciwwuqthin,1
5709,8146,rescuers,Surabaya,video we re pick bodi water rescuer search hundr migrant mediterran ... http //t.co/geu4h46csz,1
5710,8147,rescuers,#iminchina,video we re pick bodi water rescuer search hundr migrant mediterranean ... http //t.co/yhqu5uv6ok,1
5711,8149,rescuers,,world fear miss migrant med rescuer search survivor boat carri mani ... http //t.co/6ds67xai5 news,1
5712,8150,rescuers,Africa,durban_knight rescuer search hundr migrant mediterranean boat carr ... http //t.co/cwcvbubs01 nosy_b,1
5713,8154,rescuers,,i unexplain desir watch the rescuer childhooddefin,0
5714,8155,rescuers,Nigeria,roddypiperauto fear miss migrant med rescuer search survivor boat carri ... http //t.co/97b8avgewu,1
5715,8156,rescuers,Birmingham,andygild channel 5 rspca dog rescuer ..... the infomerci crept back door,0
5716,8158,rescuers,,video we re pick bodi water rescuer search hundr migrant mediterranean boat carryi ...,1
5717,8159,rescuers,,womanûª gps app guid rescuer injur biker marin counti http //t.co/uojy4e2sv4,1
5718,8161,rescuers,,video we re pick bodi water rescuer search hundr migrant mediterran ... http //t.co/zg1yddywa5,1
5719,8162,rescuers,London,video we re pick bodi water rescuer search hundr migrant mediterran ... http //t.co/puezv6bd37,1
5720,8163,rescuers,,video we re pick bodi water rescuer search hundr migrant mediterranean boat carryi ...,1
5721,8164,rescuers,,video we re pick bodi water rescuer search hundr migrant ... http //t.co/awtscucbbv africa news,1
5722,8165,rescuers,,last second ebay bid rt http //t.co/oekucq4zl0 shaolin rescuer dvd 2010 shen chan nan chiang five venom kung fu pleas favori,0
5723,8168,rescuers,,video we re pick bodi water rescuer search hundr migrant mediterranean boat carryi ...,1
5724,8169,rescuers,,worldnew video we re pick bodi water bbc news home rescuer search hundr .. http //t.co/6hhmbdk9yo,1
5725,8170,rescuers,"?????????????, Thailand ",video we re pick bodi water rescuer search hundr migrant mediterran ... http //t.co/zfwmjh6slh,1
5726,8171,rescuers,,http //t.co/xlfi7ovhfj video we re pick bodi water rescuer search hundredsû_ http //t.co/raq4zpdvk,1
5727,8172,rescuers,17th Dimension,ah-maz stori power anim rescuer a starv homeless dog futur rescu person ... http //t.co/ficd5qbqwl,1
5728,8175,rescuers,,rescuer search hundr migrant mediterranean boat carri mani 600 peopl capsiz coast ofû_,1
5729,8176,rescuers,Washington,news mani death shipwreck rescuer tri save hundr migrant ... http //t.co/tx51oybrn6 via thenewshyp,1
5730,8177,rescuers,USA - Canada - Europe - Asia,video we re pick bodi water rescuer search hundr migrant mediterran ... http //t.co/pspm3ahgkq,1
5731,8180,rescuers,worldwide,video we re pick bodi water rescuer search hundr migrant mediterran ... http //t.co/yvo6q6w442,1
5732,8181,rescuers,Phoenix,when rescuer found him he was bare aliv but they had no idea he was allerg to this http //t.co/vecmsiuuh1,1
5733,8182,rescuers,,fear miss migrant med rescuer search survivor boat carri mani 600 migrant ... http //t.co/gx9skuau9j,1
5734,8183,rescuers,,video we re pick bodi water rescuer search hundr migrant mediterranean boat carryi ...,1
5735,8184,rescuers,,woman 's gps app guid rescuer injur biker marin counti sfgate http //t.co/iz9u8bhfaa,1
5736,8187,rescuers,,fear miss migrant med rescuer search survivor boat carri mani 600 migrantsû_ http //t.co/v9ftyb30ei,1
5737,8188,rescuers,,rescuer find survivor nepal earthquak buri ... http //t.co/i8sj1kws1d,1
5738,8189,rescuers,"Paris, France",rescuer recov bodi 37-year-old calgari man lake near vulcan û_ http //t.co/gaehr9bhek,1
5739,8190,rescuers,,fear miss migrant med rescuer search survivor boat carri mani 600 migrantsû_ http //t.co/ixfne5jlep,1
5740,8191,rescuers,"Here, there and everywhere",video we re pick bodi water rescuer search hundr migrant ... http //t.co/uymxocfs33 bbc news,1
5741,8195,riot,Belgrade,to all the meat-lov feminist of the world riot grill has arriv pop quiz which prefer fem ... http //t.co/kmndkfa7m art,0
5742,8196,riot,India,stuart broad take eight befor joe root run riot against aussi,0
5743,8201,riot,"Cardiff, UK",piprhi i predict riot,1
5744,8202,riot,,teamvodg discov nickcannon listen/buy realmandyrain riot itunesmus itun https //t.co/dehmym5lpk û_ blowmandyup,0
5745,8203,riot,,to all the meat-lov feminist of the world riot grill has arriv http //t.co/um3wtl5r7k art http //t.co/2lqyxzq5dn,0
5746,8204,riot,Bossland,http //t.co/cxb55h37jn rascal flatt riot tour atlant citi beach concert-august 20 2015-2 ticket http //t.co/h6tyysgr30,0
5747,8205,riot,World Wide Web,to all the meat-lov feminist of the world riot grill hasåêarriv http //t.co/udqa53kfqu,0
5748,8208,riot,"Uppsala, Sweden",serious tactic riot headquart disney marvel ...,0
5749,8209,riot,East London,dani_riot keep eye ll look lot new team member come days/week,0
5750,8210,riot,"Detroit, MI",to all the meat-lov feminist of the world riot grill has arriv pop quiz which prefer feminist ... http //t.co/hxox7o42rq,0
5751,8211,riot,,live_workshop selfi booth riot kappa,1
5752,8212,riot,,acaciapenn i ll start big ass riot send jail today mfs shidddd,0
5753,8213,riot,,riot kit bah part new concept gear come autumn/wint menswear fashion urbanfashionû_ https //t.co/ccwzdtfbus,0
5754,8214,riot,,abran_caballero discov nickcannon listen/buy realmandyrain riot itunesmus itun https //t.co/dehmym5lpk û_ blowmandyup,0
5755,8215,riot,,i like youtub video http //t.co/5fr41tpzt thorin 's thought riot sandbox mode lol,0
5756,8216,riot,,stuart broad take eight befor joe root run riot against aussi stuart broad took career-best figur 8 ... http //t.co/zgsjwxdrcm,0
5757,8217,riot,"Los Angeles, CA",retweet sarah silverman sarahksilverman soundtrack walk start w tracey ullman they do n't know perfect,0
5758,8218,riot,,to all the meat-lov feminist of the world riot grill has arriv http //t.co/tiost8okvx,1
5759,8219,riot,,after time riot realli make offici satan teemo skin http //t.co/tytpbc4gwi,0
5760,8221,riot,"Montana, USA",i like youtub video http //t.co/lamsdzkcuz sick riot shield slide spot,0
5761,8223,riot,"Utah, USA",bytorrecilla torrecilla we alway info secret lol game check secret get 600.000 riot point bio,0
5762,8224,riot,"Frankfort, KY",transwomen drag queen color lead riot well known butch lesbian usual credit incit,0
5763,8225,riot,Los Angeles,eac4au you pre-ord film itun amp watch 9/15 yay http //t.co/fvp3wnid4l http //t.co/bwdhibtik http //t.co/qelroci7bi,0
5764,8226,riot,United Kingdom,without alli near ca n't use skill how get hire realli caus 's make everi riot staff member look incompet,0
5765,8231,riot,In Space,pop quiz which prefer feminist revolut fri ravioliåêwith porcini ricottaû_ http //t.co/n6mcpgvwq2 http //t.co/s8oinfgxyx,0
5766,8232,riot,,to all the meat-lov feminist of the world riot grill has arriv http //t.co/skaausjpo4 oliviamiles01,0
5767,8234,riot,"Sligo and Galway, Ireland",davidjordan88 stephanenni except n't know start riot even make sens credit particular individu ...,1
5768,8235,riot,"Los Angeles, CA",trollkratto juan carlo salvador the secret tip get 100.000 riot point lol check secret bio,0
5769,8236,riot,Seattle,southeast dirt riot seri crown champion southeast dirt riot seri crown championsblackfoot id the so ... http //t.co/v9i4pfxo0c,0
5770,8237,riot,Tipperary (Long Way) ,sweetpea 's run riot allot brighten raini day http //t.co/6ndbfopk5m,1
5771,8238,riot,Mumbai,stuart broad take eight befor joe root run riot against aussi,0
5772,8239,riot,Malang,riot polic interven southampton vitess arnhem support clash û¢ fan clash buildup second ... http //t.co/skvnmtzgeg,1
5773,8240,riot,,jwalkerlyl discov nickcannon listen/buy realmandyrain riot itunesmus itun https //t.co/dehmym5lpk û_ blowmandyup,0
5774,8241,riot,"San Francisco, CA",cracker white riot http //t.co/cc7d0wxk0m nowplay,0
5775,8242,rioting,hertfordshire.,but govern care polic stop riot eventu protestor eventu skyscrap becom plant-cov,1
5776,8243,rioting,Dublin,new doco tonight 9pm setanta sport ireland freeview the largest polic presenc soccer game ireland stop prevent riot,0
5777,8244,rioting,,eric clapton shot sheriff 1974 guess mani peopl riot right none,1
5778,8245,rioting,Spare 'Oom,kill val i 'm riot emmerdal,0
5779,8246,rioting,SURROUNDED BY WEEABOOS,money ca n't buy happi lie tell poor peopl keep riot,1
5780,8247,rioting,,bloodi hell 's alreadi upgrad riot hyperbol saintsfc,1
5781,8250,rioting,Australia,twitter count riot financi collaps brazil rio2016 http //t.co/9mtrq5jf4d,1
5782,8251,rioting,,would black dude antioch would riot,0
5783,8252,rioting,NYC,runjewel recent met bbc discuss race relat america amp benefit riot loveislov https //t.co/6ce1vwovh,0
5784,8253,rioting,Vidalia GA,reuter peopl like charg inevit riot contribut lie,0
5785,8254,rioting,"Vista, CA",http //t.co/wspuxorewb cindi noonan cindynoonan-heartbreak baltimor riot yahistor undergroundrailraod,1
5786,8256,rioting,Serva Fidem,leed fan .... riot embra lower tier/ leagu cup final ... dee dum,1
5787,8257,rioting,,still riot coupl hour left i class,1
5788,8258,rioting,"Bellville, Ohio",cloydriv plenti black peopl riot tosu championship well,0
5789,8259,rioting,trapped in America,evacid the ferguson riot work this next time say riot n't chang anyth there fix,1
5790,8261,rioting,A little house in the outback.,bbcnew the ass british insur say riot cost insur amp 163 163 million but polic number reduc blind fat contr,1
5791,8262,rioting,tri state,bhramabul watch run the jewel use fact defend riot ferguson the social mind duo take ... http //t.co/ld5p1sia2n,1
5792,8264,rioting,Upstate New York,i think twitter invent keep us insomniac riot wee small hour,0
5793,8266,rioting,,blutz10 peopl n't riot justic serv murder behind bar simpl no justice=no peac justice=peac,1
5794,8267,rioting,,still riot gmail ...,0
5795,8270,rioting,"Scotland, United Kingdom",jasalhad brianboru67 jimskiv92 hijinks1967 riot,1
5796,8271,rioting,,ryleedowns02 nevaehburton33 i n't get money tomorrow riot,0
5797,8274,rioting,,rt whi sweden is n't venezuela there day riot venezuela riot direct grû_ http //t.co/gjfd85vuf2,1
5798,8276,rioting,Chicora ?? Oakland,davidolszak riot happi valley penn state lose,0
5799,8278,rioting,,aelinrhe group mascara smear girl riot horrif i think,1
5800,8279,rioting,,the last time high profil name due sign nffc citi riot wesley verhoek household name don'tpan,1
5801,8280,rioting,"heart of darkness, unholy ?",georgous__ altern legal altern protest riot may peac thing 's demonstr,0
5802,8283,rioting,"Colonial Heights, VA",halljh1720 i sick crimin parent friend riot kill polic you n't give damn offic,1
5803,8284,rioting,,blutz10 but riot began prior decis indict re realli make sens pointû_,1
5804,8285,rioting,India,the ash test match current interest stupid congress riot ...,1
5805,8286,rioting,The Weird Part of Wonderland,peopl riot everywher i think i 'd one usami-san lt 3,1
5806,8287,rioting,,footbal hooligan jail riot game scotland alreadi ban match england uknew http //t.co/q5mp2q6hy8,1
5807,8288,rioting,Alabama,http //t.co/jmzcaqydfa cindi noonan cindynoonan-heartbreak baltimor riot yahistor undergroundrailraod,0
5808,8289,rioting,A little house in the outback.,am bbcnew the ass british insur say riot cost insurers163 million but polic number reduc blind fat control,1
5809,8291,rioting,Cassadaga Florida,fa07af174a71408 i live amp famili live countri looter shot sight riot n't toler whi,1
5810,8292,rubble,"Columbus, Georgia",refus let life reduc rubbl when shit keep pile get shovel expirehc,0
5811,8294,rubble,"Minna, Nigeria",china 's stock market crash are there gem in the rubbl chinaûª stock market crash su ... http //t.co/kabk3tcjnl ... via forb,0
5812,8295,rubble,,if go nuclear arm race go make rubbl bounc winston churchil,0
5813,8296,rubble,,accionempresa chinaûª stock market crash summer spark interest bargain hunt ... http //t.co/s0eyq1weh gerenciatodo å¨,1
5814,8297,rubble,,accionempresa chinaûª stock market crash summer spark interest bargain hunt ... http //t.co/go0pkrfzmf gerenciatodo å¨,0
5815,8298,rubble,,my parent impuls sometim i rememb come home room fill dust amp rubbl want redesign,0
